active_founders,batch,founded,industry,jobs,location,logo,long_description,name,region,short_description,status,tags,team_size,website
"Eric Norman,Jim Reich",W15,,"Consumer,Consumer Electronics",0,Palo Alto,,Cinder designs and manufactures premium smart cooking appliances that empower people who love great food to evolve the way they cook and eat at home.,Cinder,"Palo Alto, CA, USA",The World’s First Countertop Precision Grill –  using two ceramic…,Inactive,hardware,2,https://cindercooks.com
"Alfonzo Brooks,Frederick Hutson,Clifford Keeney",W15,2012,"Consumer,Social",0,"Las Vegas, NV",https://bookface-images.s3.amazonaws.com/small_logos/2d6146b59ed02efa52a8b7b68f1045640961f621.png,"Pigeonly is a subscription-based platform that makes it easy for people to search, find, and communicate with an incarcerated loved from anywhere in the world.  Our technology cuts the cost of expensive prison calls by 80% and allows our customers to send their inmate printed photos, greeting cards, and more right from any cell phone, tablet, or computer. 

At the core of the Pigeonly business is our proprietary inmate API, Haystac, that searches and organizes millions of Federal, State, and County records in real-time to determine the location of 2MM+ inmates across all prison facilities. This makes it possible for our users to easily search, find, and connect with their incarcerated loved one using one or all of our 6 consumer-facing products.

Pigoenly's target market usually has to settle for poor product design and is often the victim of predatory business practices. At Pigeonly, we focus on providing quality products at affordable prices; pair that with five-star customer service to achieve a superb customer experience never seen in the market. We understand just how important this is to our customer because we are our customer.",Pigeonly,"Las Vegas, NV, USA","The affordable way to search, find & communicate with an incarcerated…",Inactive,,40,http://pigeonly.com
"Yan Ma,Neil Mathew,Prasenjit Mukherjee",W15,2015,"B2B,Marketing",0,"Toronto, Canada",https://bookface-images.s3.amazonaws.com/small_logos/ded86f0a0f49180c787803bef08563dd167f5851.png,"Dabble is a virtual photo studio for e-commerce powered by hyper-realistic CGI and computer vision. The demand for content in retail is skyrocketing due to the pandemic induced surge in online shopping, but product photography is still extremely slow, tedious and expensive. We’re building a platform to scale and automate product photography for every e-commerce brand.",Dabble,"Toronto, ON, Canada",A synthetic photo studio for e-commerce,Inactive,"artificial-intelligence,augmented-reality",3,https://dabble.so
"Cristian Asenjo,Charlie Gascon,Mikhail Levkovsky",W15,,"Consumer,Home and Personal",0,"Berkeley, CA",,"Spoil fundamentally changes the way people interact with each other. Spoil brings people closer to on another through genuine gestures that are fueled by technology. 

With a tool that empowers its users to engage in positive human interaction, Spoil inspire them to give, and enhances how they receive. Using technology, Spoil predicts what makes someone happy and leverages on-demand logistics to make it happen. 

With Spoil you can make anyone happy as easily as calling an Uber.

Spoil is all about the experience we provides to both the sender and the recipient. Focusing on how we want the recipient to feel, each step of the process leverages the right emotions and builds a story around the Spoil being received. This makes sending a Spoil a thoughtful gesture as opposed to just an exchange of items.

Spoil help individuals and corporations acknowledge people around them through genuine gestures. It is the only medium accessible to everyone that builds simple, contagious and ubiquitous happiness. 

Because, we believe that everyone should be Spoiled.",Spoil,"Berkeley, CA, USA",Spoil is gifting for the Snapchat generation.,Inactive,social,2,https://www.spoil.co/
"Ryan Dalton,Brandon Hamric",W15,,Government,0,"Nashville, TN",,Rescue Ops is a digital forensic that archives massive quantities of data from classified advertisement websites specializing in commercial sex ads for law enforcement agencies to use in anti-trafficking investigations.,Rescue Forensics,"Nashville, TN, USA",Actionable human trafficking intelligence,Inactive,analytics,0,http://rescueforensics.com
"Soren Berg,Joe Waltman,Katherine van Ekert",W15,,"Healthcare,Consumer Health and Wellness",0,San Francisco,,"Currently servicing the San Francisco Bay Area, Los Angeles, New York, Chicago, Washington DC, Baltimore, Atlanta, New Orleans and Tampa Bay.

VetPronto is a new type of Veterinary Service dedicated to providing the most quality, convenient and transparent veterinary care possible. We're empowering vets across the country to better serve their patients. 

We treat pets at the home or workplace, saving them stress, and you time. We're using tech to provide a new standard of medical record management, client communication, and operational efficiency, including telemedicine and pharmacy integration.",VetPronto,"San Francisco, CA, USA",On demand veterinary house calls. ,Inactive,healthcare,51,http://vetpronto.com
Jeff Huber,W15,2015,"Healthcare,Medical Devices",0,San Francisco,https://bookface-images.s3.amazonaws.com/small_logos/ea641cf296beace7a7288415d4808dc519f3a987.png,"We are multiplying the potential of the real world by making computer vision accessible to all.

We create the cloud and edge tools that developers and non-developers require in order to build, deploy, and improve CV solutions quickly.

standardcyborg.com (YC W15)",Standard Cyborg,"San Francisco, CA, USA","Buid, test and deploy perception applications",Inactive,"machine-learning,computer-vision,open-source",9,http://standardcyborg.com
"Darwin Lo,Chris Turitzin",W15,,"Healthcare,Consumer Health and Wellness",0,San Francisco,,"Wink Health is a simple and effective way to get treatment for sleep apnea online. About 90% of people with sleep apnea go untreated. Our goal is to remove the barriers to getting diagnosed and receiving treatment.

We do this through a combination of a smartphone app that 'listens' for sleep apnea risk, telehealth consultations with doctors, and treatments shipped to people's homes.",Wink Health,"San Francisco, CA, USA",The digital sleep clinic,Inactive,"sleep-tech,health-tech",2,http://winkhealth.com
Nadir Bagaveyev,W15,,"Industrials,Aviation and Space",0,"San Mateo, CA",https://bookface-images.s3.amazonaws.com/small_logos/14f8db89f9d048abddf9030226e5fdf23183c1c4.png,"Bagaveev Corporation is a startup backed by Adam Draper's Boost accelerator (boost.vc)

and advised by Tim Draper (dfj.com) is designing, building and testing

3D printed aerospike rocket engines that will power both lower and upper stages

of a 3-ton, 35 foot rocket, designed to deliver 10-12 kg nanosatellites

to low Earth orbit and Sun-synchronous orbit.",Bagaveev Corporation,"San Mateo, CA, USA",Launch small satellites,Inactive,"space-exploration,satellites",2,http://bagaveev.com
"Varun Boriah,Andy Rink",W15,,"Healthcare,Consumer Health and Wellness",0,San Francisco,https://bookface-images.s3.amazonaws.com/small_logos/3dccd9733589a8183a0d3d6488678781eec47b9d.png,"At Lully, we’re building the children’s sleep company. We create innovative, thoughtfully-designed, clinically-proven consumer products to help children, and their families, sleep better. 

Our first product, The Sleep Guardian is the only solution for night terrors. Based on our patented, clinically-proven technology, the Sleep Guardian goes under the mattress and uses precisely-timed vibrations to avoid night terror episodes completely. 

The Sleep Guardian is just the initial product in a suite of smart solutions based on our process: combining a user-centric approach with a clinical understanding of sleep to solve unmet problems in children’s sleep. 

Based in San Francisco, Lully was founded by Dr. Andy Rink, a doctor and father, and Varun Boriah, a medical device entrepreneur. 

Lully was spun out of the Stanford Biodesign Fellowship and is backed by Y Combinator, Two Sigma Ventures, Stanford-StartX Fund and Highway1. We’ve partnered with Stanford Sleep and Riley Children’s Hospital in our goal to help families sleep better.",Lully,"San Francisco, CA, USA",Lully is developing an under-the-mattress technology that precisely…,Inactive,"sleep-tech,health-tech",5,https://www.lullysleep.com/
,W15,,"B2B,Marketing",0,"San Mateo, CA",,"On a mission to automate, optimize, and unify your digital advertising campaigns with incredible software.",Automate Ads,"San Mateo, CA, USA","On a mission to programmatically automate, optimize, and unify your…",Inactive,"analytics,advertising",2,http://kuhcoon.com
"Abe Fetterman,Lisa Q. Fetterman",W15,,"Consumer,Home and Personal",0,San Francisco,,"Founded in 2012, Nomiku invented the home sous vide immersion circulator and are make it connected. 

Proudly manufactured in the United States, Nomiku’s quality is renowned in the culinary world and put to the test in thousands of homes and the best restaurants in the world every night.

Chefs on Main Street, Michelin-starred restaurants, and most everywhere in between have been dazzling diners with their sous vide creations for years. Nomiku led the way for people to use it at home in 2012 with the invention of the home sous vide immersion circulator funded by two successful Kickstarter projects totaling over $1.3M raised. They turned this modernist gadget into a useful everyday kitchen tool by dramatically reducing the price of the machine and redesigning it from the bottom up for at-home functionality. Five years later, the sous vide machine is turning into a mainstream darling and the advent of the Nomiku Sous Chef Meal delivery program (launching on May 15, 2017) breaks the last barriers to make sous vide accessible to everybody.
 
The Nomiku Sous Chef launch comes at the heels of Samsung Ventures participating in an investment round in the startup. Nomiku is a partner of the Samsung Family Hub 2.0 program and allows for app integration into their smart kitchen offering.",Nomiku,"San Francisco, CA, USA",Wave our food in front of your Nomiku and have dinner for everyone…,Inactive,food-tech,11,http://nomiku.com
Tony Gauda,W15,,"B2B,Security",0,Palo Alto,,"At ThinAir They are building the future of data security--and it's wrought with exciting engineering challenges!

As a cloud-based SaaS product, ThinAir is the first data security solution that allows everyone—administrators and employees alike—to take control over their most sensitive data in a way that enhances, not hinders their productivity.

They were the 2014 DEMO Enterprise's DEMOGod Winner and they completed Y Combinator as part of W15.",ThinAir,"Palo Alto, CA, USA",Intelligent data security for teams,Inactive,"cybersecurity,enterprise",11,http://thinair.com
"Oliver Staehelin,Catherine Spence",W15,2014,"B2B,Recruiting and Talent",0,San Francisco,,"Pomello maps your organizational culture on a team-by-team basis, and integrates with your existing recruiting process to allow you to find the candidates most likely to thrive within your organization. 

Founded at Stanford University, Pomello’s technology is based on 30 years of research in Organizational Behavior, which has been validated over time across multiple industries.",Pomello,"San Francisco, CA, USA",Analytics software that helps companies measure organizational…,Acquired,"machine-learning,saas",8,http://pomello.com
Matt Rothstein,W15,,"Fintech,Payments",0,"Oakland, CA",https://bookface-images.s3.amazonaws.com/small_logos/a9f9365e5ac7dcefbab5bfab9129637279050427.png,"At Final, we are re-building the credit card from the ground up. 

Final is issuing a credit card that gives consumers total control over their merchant relationships, transparency in their spending, and piece of mind across all payment experiences. Rather than a single, 16-digit card number, Final generates multiple card numbers and manages them automatically.

It works everywhere you buy; online, and offline, and integrates with digital wallets like Google Wallet and ApplePay with zero updates to the payment infrastructure. Bottom line - with Final, you’ll never lose access to your spending ability from a breach, fraud, cancelled or stolen card ever again.",Final,"Oakland, CA, USA",A credit card that drastically reduces payment fraud and gives…,Acquired,"payments,security",11,http://getfinal.com
Willis Wee,W15,2011,"Consumer,Content",0,"Singapore, Singapore",https://bookface-images.s3.amazonaws.com/small_logos/054014714327c1ca4a89093ff488ef0e91f04649.png,"Tech in Asia (YC W15) is the largest English-language technology media company that focuses on Asia. From the latest news to the hottest trends and the boldest startups to the strongest titans, we cover everything tech in the region. Our goal is to build and serve Asia’s tech and startup community.",Tech in Asia,"Singapore, Singapore",Tech in Asia (YC W15) is the largest English-language technology…,Acquired,,70,http://techinasia.com
"Jennifer Kessler,Chiara McPhee",W15,,"B2B,Retail",0,San Francisco,,"Bizzy is an automated marketing platform designed to boost sales for ecommerce shops. Bizzy is the first tool to centralize a business’ entire marketing portfolio around a single, dynamic set of customer data. As this centralized data updates based on customer behavior and marketing interactions, Bizzy adapts and executes a business'​ campaigns.",Bizzy,"San Francisco, CA, USA",Bizzy is omni-channel marketing for ecommerce businesses.,Acquired,"e-commerce,marketing",2,http://bizzy.io
"Pete Hunt,Julian Tempelsman,Josh Yudaken",W15,,"B2B,Security",0,San Francisco,,"Smyte stops spam, scams, harassment and credit card fraud for marketplaces and social networks.  We automatically classify your website and mobile app's event data and stop bad actors at scale.",Smyte,"San Francisco, CA, USA",Smyte stops bad actors on social networks and marketplaces.,Acquired,"security,fraud-detection",11,http://smyte.com
Alejo Verlini,W15,,"Consumer,Consumer Electronics",0,New York,,"Bluesmart is a global travel company that became famous for creating the world's first smart connected luggage. Its first product, the Bluesmart Carry-on, launched in October 2014 through Indiegogo and raised more than $2M in pre-orders from more than 10,000 backers in 120 countries worldwide. It was named ""Top Innovative Product and Service""​ by Forbes Magazine, awarded ""Best Travel Gear""​ by Fast Company and “Best of the Best""​ Red Dot Design Award. The company is backed by Y Combinator and other top Silicon Valley venture investors. Bluesmart is headquartered in New York with offices in Hong Kong, China and Argentina.",Bluesmart,"New York, NY, USA",Bluesmart makes smart luggage powered by an app to empower people to…,Acquired,"iot,travel",51,http://bluesmart.com
Sreenath Kurupati,W15,,"B2B,Security",0,"Santa Clara, CA",,"Cyberfend offers a robust security solution to protect your web and mobile applications from sophisticated attacks and fraudulent activity. Cyberfend's solution detects account take-over, payment fraud and the use of stolen credentials. All of these problems are relevant to every consumer facing web and mobile product/service. 

Cyberfend’s solution uses a new security paradigm – human cognitive science coupled with advanced machine learning. The result is a robust detection system with near zero false positives and false negatives. Today Cyberfend protects nearly a billion login and payment transactions every month for many large e-commerce, web and payment customers. 

Cyberfend's product is at the intersection of almost every single cutting edge technology today : a) Our core product employs heavy machine learning b) On the backed, our product is cloud based and deals with enormous scale (customers are directing significant portions of their traffic to us) c) On the front end we need to deal with both web and mobile (IOS, SDK) challenges.Please visit us at: www.cyberfend.com.

Cyberfend is backed by Y Combinator, SV Angel and A Capital. 

Cyberfend was acquired by Akamai Technologies in December 2016.",CyberFend,"Santa Clara, CA, USA","Cyberfend delivers robust, real-time web and mobile security by…",Acquired,"cybersecurity,fraud-prevention",2,http://cyberfend.com
"Val Agostino,Dave Bryand,Dave Kashen",W15,,"B2B,Productivity",0,San Francisco,,"WorkLife is a web app that helps teams have more productive meetings. There are over 3 Billion meetings/year in the U.S. and studies show 50% of that time is completely wasted. WorkLife helps you reclaim that time by helping you and your team adopt good meeting habits - create agendas, stay on track during the meeting, and ensure next steps get done afterwards.

Most people spend the majority of their waking hours at work, and way too many of those hours in unproductive meetings. Your work life is a big portion of your life -- and the happier and more productive you are at work, the more fulfilled and energized you are in your life. Better Work = Better Life.",WorkLife,"San Francisco, CA, USA",WorkLife is a SaaS application that helps teams have more effective…,Acquired,"saas,productivity,collaboration,enterprise-software",2,http://worklife.com
"Rob Hunter,Jef Chedeville",W15,2014,"B2B,Recruiting and Talent",0,"Toronto, Canada",https://bookface-images.s3.amazonaws.com/small_logos/94e9b636b74d579c5321c7c9dcd9349d3ca2685b.png,"HigherMe is all-in-one hiring software for restaurant and retail businesses to easily recruit, screen, interview, and onboard employees. Quickly review applications, schedule interviews, manage job board postings, and fill out employee paperwork from anywhere on any device. 

Created by a former multi-unit franchisee, HigherMe reduces the time and cost of hiring using a mobile-first applicant tracking system, Text-To-Apply technology, one-click interview scheduling, video cover letters, and more. With over three million applications submitted using our cloud-based software, say goodbye to the stack of paper résumés and easily fill open jobs anywhere, anytime.",HigherMe,"Toronto, ON, Canada",Helping restaurant employers find & hire better employees faster,Acquired,"saas,hr-tech",45,http://higherme.com
"Alex Farrill,Peter Sugihara,Judd Schoenholtz",W15,2015,"Real Estate and Construction,Housing and Real Estate",0,"Los Angeles, CA",https://bookface-images.s3.amazonaws.com/small_logos/3cb771450cbbd7b08b3bb5a55835dc2448963273.png,"Open Listings was the all-in-one homebuying app designed to make buying a home simple and more affordable. We helped buyers purchase billions of dollars worth of homes and saved them over $25 million in commission fees.

Acquired by Opendoor in 2018.",Open Listings,"Los Angeles, CA, USA",A better way to buy a home,Acquired,"marketplace,real-estate",48,https://www.openlistings.com
Beth Kolko,W15,2012,"Healthcare,Medical Devices",0,"Seattle, WA",https://bookface-images.s3.amazonaws.com/small_logos/2246133183bed9d3422eac6444861816329babc9.png,"Shift Labs makes medical devices that place technology and design on equal footing to create affordable solutions. We emphasize simplicity and create devices that serve the fastest growing healthcare markets in the world.

We believe that every person in the world deserves quality healthcare -- whether they are receiving care in the home, in an outpatient infusion center, or in an emerging market. 

We're a for-profit company committed to doing well, and doing good.

We believe Simple Saves Lives.
___

In true startup fashion, we have a strategy that emphasizes early revenue. So check out our first product DripAssist, a low-cost IV fluid monitor and alarm. Get precision monitoring of blood transfusions or fluid delivery at a fraction of the cost of an infusion pump. Purchase at http://www.shiftlabs.com/purchase-dripassist",Shift Labs,"Seattle, WA, USA","Makers of simple, affordable medical devices. Our award-winning…",Acquired,"hardware,medical-devices",6,http://shiftlabs.com
"Dillon Erb,Daniel Kobran",W15,2015,"B2B,Engineering, Product and Design",0,NY,https://bookface-images.s3.amazonaws.com/small_logos/71d8fe724bf62445db1e2f76ff63e411c7f74f2c.png,"Paperspace is a cloud computing company creating simple and scalable accelerated computing applications. Our goal is to allow individuals and professional teams to seamlessly build and deploy computationally complex products and services.

Paperspace is backed by leading investors including Y Combinator and Initialized Capital.

Mission:
Our mission is to make cloud computing more accessible through radical simplicity, community-driven technical resources, and straightforward pricing.

--
To learn more about Paperspace, please visit https://www.paperspace.com/ or follow us on Twitter at: @hellopaperspace.",Paperspace,"NY, USA",Paperspace is a cloud platform for building and scaling AI…,Acquired,artificial-intelligence,50,https://www.paperspace.com
"Joe Doliner,Joey Zwicker",W15,2014,"B2B,Infrastructure",0,San Francisco,https://bookface-images.s3.amazonaws.com/small_logos/23351b36c00bacc651a4389386057c50f0690542.png,"Pachyderm is a tool for production data pipelines. If you need to chain together data scraping, ingestion, cleaning, munging, wrangling, processing, modeling, and analysis in a sane way, then Pachyderm is for you. If you have an existing set of scripts which do this in an ad-hoc fashion and you're looking for a way to ""productionize"" them, Pachyderm can make this easy for you.",Pachyderm,"San Francisco, CA, USA","Data Versioning, Data Pipelines, and Data Lineage",Acquired,"developer-tools,machine-learning,data-science",60,http://pachyderm.com
"Wen Sang,Maokai Lin",W15,2014,"B2B,Analytics",0,San Francisco,https://bookface-images.s3.amazonaws.com/small_logos/ebad8fcce5239d928f1d4d5d9a93312dd9a5c4f9.png,"Smarking is a group of hyper-driven MIT PhDs, data scientists, engineers, transportation experts, and battle-tested business professionals working to solve the notorious parking problem via a unique enterprise approach. Smarking aims to enable highly efficient urban mobility by digitizing parking spaces and distributing parking inventory dynamically, in order to get the world ready for the connected, shared, and autonomous future. 

Backed by top VCs like Y Combinator and Khosla Ventures, Smarking has brought its solution to over 2,500 parking locations across North America. For the first time, cities, parking asset owners, and parking operators can make data-driven decisions easily. Smarking also launched the industry’s first fully automatic dynamic pricing engine, producing 40%-400% revenue uplifts for online sales at at parking locations Chicago, NYC, Boston, and many other cities. ",Smarking,"San Francisco, CA, USA",Digitize $655B parking industry,Acquired,"saas,ai",17,http://smarking.com
Bruno Didier,W15,2014,"B2B,Retail",0,"Austin, TX",https://bookface-images.s3.amazonaws.com/small_logos/a1eda5fbe5161f15b09714a408c3288e4f948adf.png,"MobyDish, a tech-enabled service, allowing anyone to place a catering order online in less than 3min to feed people from 10 to 1,000 people. We select the best restaurants, hire and train our fleet of drivers who will deliver and setup and we're proud to have the best customer service in the space. We also offer on site catering host and premium service that can be requested in up to 48hours in advance. 
We own our tech from online ordering, to manage and dispatch orders to drivers, and build customer relationship. 

We're used by top companies in the biggest cities in the US and we help for our customers with any needs from breakfast, lunch, happy hour and dinner. We are known for our flexibility, reliability and provide recurring and last-minute catering orders. ",Mobydish,"Austin, TX, USA","MobyDish, a tech-enabled service, allowing anyone to place a catering…",Acquired,"food-service-robots-&-machines,food-tech",10,https://www.mobydish.com
"Tiffany Chu,Sam Hashemi,Daniel Getelman,Danny Whalen",W15,2014,Government,0,San Francisco,https://bookface-images.s3.amazonaws.com/small_logos/d61c2a371b31c9e15555407e966ec3992500d5d0.png,"Remix’s mission is to help build more livable cities. Our software helps city planners understand their communities and design transportation systems that serve them. We’ve partnered with over 325 cities across 20 countries on 4 continents — and were continually seeking to grow our impact around the world.

Urban planning impacts everything from economic mobility to CO2 emissions, and our platform empowers local governments to transform their transportation systems, design safer streets, and implement new mobility options to better serve their communities.",Remix,"San Francisco, CA, USA",We’re building a platform to empower cities to plan the best possible…,Acquired,"saas,transportation,mobility",65,https://www.remix.com/
