active_founders,batch,founded,industry,jobs,location,logo,long_description,name,region,short_description,status,tags,team_size,website
"Harry Clifford,Nirmesh Patel,John Cassidy,Evaline Tsai",S17,2015,"Healthcare,Diagnostics",0,"Cambridge, United Kingdom",https://bookface-images.s3.amazonaws.com/small_logos/53b0518d38ef7cc187360951dee976ad809db1d9.png,"CCG.ai exist to ensure that each patient has the right drug, at the right time, to beat their cancer.
‍
We build the software to enable data-driven precision oncology and systematically develop data-driven biomarkers indicative of treatment response. We believe that increasing amounts of clinical and genomic data have the potential to transform cancer treatment, and enable oncologists to make smarter decisions about which drug to use in which circumstance.

We are expanding our team in Cambridge, UK, offering a fantastic opportunity for dedicated individuals who are comfortable in a high-work high-reward environment, and who are enthusiastic for a dynamic and varied role. We are looking for people who fit well into our team and company culture, and who like to overcome challenges and drive the business forward. In exchange, we offer a competitive salary with performance related bonuses and stock options, alongside excellent career development opportunities in a fast-growing start-up with a chance to truly impact how cancer is treated.

To apply, please send your CV to info@ccg.ai",Cambridge Cancer Genomics,"Cambridge, England, United Kingdom",CCG.ai empowers clinicians to make personalised treatment strategies…,Inactive,genomics,25,http://ccg.ai
"Alexander Mistakidis,Carter Minshull",S17,,"Consumer,Gaming",0,"Santa Monica, CA",https://bookface-images.s3.amazonaws.com/small_logos/4f594856da7516e2da32926b353dc6064da567fe.png,"Gamelynx is creating easily watchable cross-platform competitive games. We're a passionate team with diverse experience from Riot Games, Google, Jane St, and Quantum Computing research labs. Gamelynx has raised $1.2 million to date with investors including Riot Games, M Ventures and Y Combinator. ",Gamelynx,"Santa Monica, CA, USA",Easily watchable cross-platform competitive games.,Inactive,gaming,5,https://gamelynx.gg
Ben Huh,S17,2017,"Real Estate and Construction,Housing and Real Estate",0,San Francisco,https://bookface-images.s3.amazonaws.com/small_logos/77728f2f64e77cb7da261234ba8c6dec47aab98f.png,"Social Construct is inventing new processes and technologies to assemble high quality apartment buildings for faster and for less--so we can all afford to live in places we love. 
",Social Construct,"San Francisco, CA, USA",Social Construct designs and assembles large apartment buildings …,Inactive,"generative-ai,hardware,housing",17,http://socialconstructco.com
"Amit Patel,Puja Shah",S17,,"Healthcare,Healthcare Services",0,San Francisco,,,Bumpline,"San Francisco, CA, USA",Captain Tailor is the Uber for tailoring. ,Inactive,marketplace,2,https://bumpline.com/
"Devin Miller,Anu Sridharan",S17,,"Industrials,Energy",0,"Bengaluru, India",https://bookface-images.s3.amazonaws.com/small_logos/67360132b1680f560e9b085055d4bff122269265.png,"NextDrop is a for-profit enterprise with a social mission- we want to rid the world of its water problems. It’s not a big deal. We think it can be done. And what we’ve managed to achieve so far only reaffirms our belief. 

NextDrop was founded in 2011 with a pilot in Hubli-Dharwad district of Karnataka. Four years later, we have 70,000 users registered with us across Karnataka. Our vision is simple- we want to link the private sector, government utilities and citizens to create an endless loop of timely service provision and feedback collection, and bridge all the gaps in between. And to do this, we try to harness the latest, cutting edge technology. 

Water is our mission. Data is our business. NextDrop crowdsources water data and creates algorithms and visualizations to improve urban water distribution across emerging markets. Urban residents can get a text message an hour before water arrives, if water supply is cancelled, or if there is contamination or low pressure present in the pipe network. On the utility side, engineers get a live feed on problems arising in the distribution system, so they can tackle issues in real time.",NextDrop,"Bengaluru, KA, India",NextDrop is the water marketplace for urban India.  We connect water…,Inactive,marketplace,11,https://thenextdrop.com/
Derek Lo,S17,,Education,0,San Francisco,,"Py is democratizing access to career opportunities in tech. Our iOS and Android apps have been featured in the App Store & Google Play Store and we've provided millions of lessons and quizzes to our users. We are changing the way that educational content is delivered and modernizing traditional online teaching tools.

We launched Py for Work to level the playing field for candidates and empower companies to take a skills-based approach to hiring. Our platform enables companies to assess candidates using real-world assessments, not brain teasers. We’re helping industry leaders like LiveRamp, Amplitude, and Factual approach hiring based on merit, not resume keywords.",Py,"San Francisco, CA, USA",Py is democratizing access to career opportunities in tech,Acquired,recruiting,3,https://www.getpy.com
"Pranay Shrivastava,Moksha Srivastava",S17,,"Consumer,Transportation Services",0,"Bengaluru, India",https://bookface-images.s3.amazonaws.com/small_logos/b74d32e12dc0532725502f65534cf69abf4a4479.png,"Wheelstreet is India's first bike rental platform offering more than 1900 two-wheelers on rent including scooters, commuter bikes, sports bikes, super bikes and premium bikes.

Wheelstreet is the only bike rental company based on an aggregator model. Wheelstreet makes the process of renting bikes completely hassle-free for its customers by offering variable rent durations, home delivery and pick-up, helmets at no added charge, and unlimited kilometres.

Launched in 2014, Wheelstreet rapidly gained over 14,000 satisfied customers before starting operations and eventually shifting its headquarters to Bangalore.

Wheelstreet is currently employing the most innovative and dedicated people from prestigious institutions such as IIT(Bombay), University of Missouri(Kansas), NMIMS, Sheffield University, Welingkar Institute and IIMC(Delhi). Wheelstreet's technological and operational prowess allows it to cater to 1000 customers per month - a number which is only growing.",WheelStreet,"Bengaluru, KA, India",WheelStreet is a Motorbike rental marketplace that connects…,Inactive,"marketplace,india",10,https://www.wheelstreet.com/
"Michael Simon,Saul Shemesh",S17,2016,Government,0,New York,https://bookface-images.s3.amazonaws.com/small_logos/0d7af849f56673d1fd654adceda7972212533a20.png,Elucd is a GovTech company that provides cities with near real-time understanding of how citizens feel about their government.,Elucd,"New York, NY, USA",Polling through mobile ads to enable governments to make better…,Acquired,"saas,govtech",8,http://www.elucd.com
"Arnaud Douceur,Sam Naimi",S17,,"B2B,Retail",0,San Francisco,,"AutoHub is a marketplace for automotive wholesale transactions. AutoHub is a transparent, efficient, convenient and cost-efficient digital auction platform.",AutoHub,"San Francisco, CA, USA",We help dealerships appraise vehicle trade-ins more efficiently…,Acquired,"diagnostics,automotive",2,https://www.autohub.io
"Christian Brink,Ryan Wegner",S17,2015,"Consumer,Content",0,New York,https://bookface-images.s3.amazonaws.com/small_logos/08af81b6a3d390826e292425721b229750993e4c.png,"Audm is a mobile app that turns long-form print journalism into professionally narrated digital audio. The app, which was quietly launched on 2016, uses professional voice actors to read news content that makes it enjoyable to listen to.",Audm,"New York, NY, USA",Audm is a subscription service providing mini-audiobooks —…,Acquired,"consumer,media,subscriptions",10,https://www.audm.com
Yinon Weiss,S17,2016,"Consumer,Transportation Services",0,"Menlo Park, CA",,"Taking care of your car doesn’t need to be a painful or archaic experience. CarDash picks up your car from home or work, oversees the work, and returns your car to you. We also offer upfront and transparent pricing and serve as your advocate so you are never overcharged. 

We are on the verge of a major transformation in our relationship with the automobile. Connected cars, self-driving cars, mainstream electric vehicles, and new economic models of car ownership are all coming within the next decade. These could bring about a transportation revolution as disruptive as the adoption of the automobile itself. We don’t know how or when these changes will unfold, nor do we know which technologies will triumph. We do however know that all cars on the road will need to be serviced, regardless of who owns them, who drives them, or what powers them. 

By leveraging technology, logistical efficiency, and above all — superior service, CarDash aspires to become the service platform for the automotive industry of tomorrow.",CarDash,"Menlo Park, CA, USA",Managed marketplace for automotive services. ,Acquired,marketplace,12,https://www.repairsmith.com
Jay Reno,S17,2017,"Consumer,Home and Personal",0,New York,https://bookface-images.s3.amazonaws.com/small_logos/78565f991ce79dae3926441dab3992eb71f84d76.png,"Feather is redefining furniture rental for city living and helping people feel at home no matter where they live or how long they plan on staying. By giving people smarter options, Feather is able to keep more furniture in homes and out of landfills.

Monthly furniture payments can go toward ownership or you can simply return the furniture you no longer need. Those items endure our extensive refurbishment process before they are sent to live in their next home. Our reverse logistics platform allows our customers to swap and add new furniture at any time, helping limit furniture waste.",Feather,"New York, NY, USA",Furniture rental for consumers and businesses.,Acquired,"marketplace,delivery,furniture",125,http://livefeather.com
"Chaz Englander,Rosie Dallas,Owen Turner-Major",S17,,"Consumer,Consumer Electronics",0,"London, United Kingdom",https://bookface-images.s3.amazonaws.com/small_logos/cacf8d9bcbb73491020dec66593dc1caf7a26073.png,"Fat Llama is a peer-to-peer rental marketplace which allows people to rent spare items to others nearby, fully insured. The platform provides a cheaper and more efficient solution than buying outright or hiring from rental shops. At the same time, it allows others to monetise their rarely-used possessions.

The company's mission is to enable people to share and monetize their unused possessions, increasing the efficiency of both the consumer and the planet’s resources.",Fat Llama,"London, England, United Kingdom",Fat Llama is the first fully insured peer-to-peer rental marketplace.…,Acquired,marketplace,41,https://fatllama.com
Doug Peltz,S17,2013,Education,0,San Francisco,https://bookface-images.s3.amazonaws.com/small_logos/ae6a8a4584ca3c15f6776168df27228f7b752cd6.png,"We started Mystery.org to create better explanations for every question children have about the world. We began with the 150 most common science questions that children ask teachers. We call this collection Mystery Science. Last year, more than 4 million children used Mystery Science in 50% of U.S. elementary schools. In an industry that is plagued by long sales cycles and high barriers to entry, we’ve sold thousands of schools without a single sales person. We’re backed by a great group of investors including Y Combinator, Learn Capital, and Reach Capital.

We’re now moving on to all the other questions children have that they’ll never learn in school. In the last 18 months we received over 500,000 questions from children eager for better explanations of the world.  Now we’re creating video explanations for every question. You can think of this like a visual Wikipedia for kids.

Our goal is to create a generation of better thinkers. We think this is the most important problem to solve in the world today.",Mystery.org,"San Francisco, CA, USA",We help kids stay curious by creating better explanations.,Acquired,"education,elearning",53,https://mystery.org
"Jared Seehafer,Jacob Graham",S17,2017,"Healthcare,Healthcare IT",0,San Francisco,https://bookface-images.s3.amazonaws.com/small_logos/3b173531902e6d3b7c41d36b3ef509819cde269e.png,"Enzyme provides online quality management system software and supportive QA/RA consulting, helping life science companies with FDA approval and ongoing compliance. Enzyme staff has over 50 years of medical device industry experience, across several Fortune 500 companies and startups.",Enzyme,"San Francisco, CA, USA",Automating regulatory approval & compliance for life science companies,Acquired,saas,32,https://www.enzyme.com
Justin Vencel,S17,,"Consumer,Travel, Leisure and Tourism",0,"Las Vegas, NV",,"Solve (YCS17) provides airport fast track, customs, and concierge services in over 470 airports worldwide. Whether it's departure, arrival, or transit, we've got you covered.",Solve,"Las Vegas, NV, USA","We save travelers hours by meeting them at their arrival gate,…",Acquired,"travel,logistics",2,https://www.solve.com
Dan Hughes,S17,,"Fintech,Insurance",0,San Francisco,,"Surematics is helping commercial insurance brokers structure complicated deals online. Homeowners and car insurance are enough of a nightmare for most of us to handle but Surematics is targeting even more difficult cases — awkward expensive items like oil rigs. With a dash of blockchain, the startup wants to allow companies to collaborate together to create enforceable contracts.",Surematics,"San Francisco, CA, USA",We help commercial insurance brokers structure complicated…,Acquired,"blockchain,insurance",2,https://www.surematics.com/
"Hriday Kemburu,Vinay A. Ramesh,Jay Patel",S17,2015,"Consumer,Social",0,San Francisco,https://bookface-images.s3.amazonaws.com/small_logos/260fba8dd813bf45cecced28e82c66d0a56b180d.png,"We started Wildfire during our senior year at UC Berkeley as a safety alert app for colleges. Wildfire quickly grew beyond a campus safety tool to a social news app, which empowered people to spread the word quickly to their community when something significant happened nearby. Over six years, we've sent 65 million alerts to nearly 1 million users.",Wildfire,"San Francisco, CA, USA",Social news app,Acquired,social-media,3,http://getwildfire.com/
Diana Hu,S17,,"Consumer,Virtual and Augmented Reality",0,"Sunnyvale, CA",https://bookface-images.s3.amazonaws.com/small_logos/bcf9121607fe68feb6169866d774e9a826e684ae.png,The most advanced Augmented Reality API.,Escher Reality,"Sunnyvale, CA, USA",The backend for Augmented Reality.,Acquired,"developer-tools,augmented-reality,gaming",2,http://www.escherreality.com/
"Josh Dorward,Kenji Hashimoto",S17,,"B2B,Marketing",0,"Redwood City, CA",https://bookface-images.s3.amazonaws.com/small_logos/8e7d48dd3dd9cd9f00d26de662d8d74acc7a4ae8.png,Indivio's video creative automation capabilities enable modern marketing teams to more easily deliver dynamic video experiences that improve business outcomes.,Indivio,"Redwood City, CA, USA",Customize videos to be more relevant and improve business outcomes.,Acquired,"analytics,video,personalization",8,https://www.indiv.io
"Henry Dornier,Paul Dornier",S17,,"B2B,Productivity",0,San Francisco,,"Meetingbird is the calendar with superpowers. Individuals and teams from companies like Uber, Shopify, and Yelp use Meetingbird to make their meetings great.

See what Meetingbird can do for you at meetingbird.com.",Meetingbird,"San Francisco, CA, USA",Automated meeting scheduling for teams,Acquired,scheduling,2,https://www.meetingbird.com
"Umar Afridi,Sid Viswanathan",S17,2017,"Healthcare,Healthcare IT",0,"San Mateo, CA",https://bookface-images.s3.amazonaws.com/small_logos/c4a973a0300bcf108fdd2a681e5499d0d9f23c5e.png,"Our API-connected healthcare infrastructure empowers our partners to deliver world-class patient experiences. We power prescribing, lab testing and pharmacy fulfillment. ",Truepill,"San Mateo, CA, USA",API-connected healthcare infrastructure.,Acquired,consumer-health-services,1300,https://truepill.com/
"Ajay Patel,Alex Sands",S17,2016,"B2B,Productivity",0,San Francisco,https://bookface-images.s3.amazonaws.com/small_logos/2ae1a81c0b76312154e82224b9883070ca8b7b54.png,Plasticity builds APIs that help developers create human-like natural language interfaces. We believe in a future where computers can actually understand language and communicate.,Plasticity,"San Francisco, CA, USA",Natural language processing APIs for developers.,Acquired,"artificial-intelligence,saas,nlp",2,https://www.plasticity.ai
Eli Brown,S17,2017,"Consumer,Gaming",0,San Francisco,https://bookface-images.s3.amazonaws.com/small_logos/3ecd47370642bafb403542bb6e6c5627d27b56b3.png,"Guilded upgrades your group chat and equips your server with integrated event calendars, forums, and more.
",Guilded,"San Francisco, CA, USA",Chat for gaming communities,Acquired,"consumer,productivity,gaming,social,chat",30,http://www.guilded.gg
Eugene Park,S17,,"Fintech,Consumer Finance",0,San Francisco,https://bookface-images.s3.amazonaws.com/small_logos/99e371e9419459527ac037bfb6531a54c832d71b.png,"Honeydue is the best personal finance app for couples. Track your bills, bank balances, and spending together, and engage in meaningful dialogue about your goals and habits.",Honeydue,"San Francisco, CA, USA","The simplest way for couples to manage money, together",Acquired,fintech,2,https://www.honeydue.com/
"Joe (Zhou) Sha,Deyang (Derek) Zhao,Shuo Han",S17,,"B2B,Operations",0,"Sunnyvale, CA",https://bookface-images.s3.amazonaws.com/small_logos/5593c360f1b3eef3f453d101e5430462548026b8.png,"Artificial intelligence for modernized customer support. We provide end-to-end AI-powered solutions for business to connect with and support their customers. By leveraging the state of art deep learning and natural language processing technology, we make the customer support teams more intelligent and efficient.",Percept.AI,"Sunnyvale, CA, USA",AI support agent for your business that actually works,Acquired,"artificial-intelligence,saas,customer-service",7,https://www.percept.ai/
"👨‍💻Fabricio Buzeto,Gustavo Gorenstein,Roberto Braga",S17,2016,"Fintech,Credit and Lending",0,Brazil,https://bookface-images.s3.amazonaws.com/small_logos/0327cd08e9a2af81efeb43fd6108a34b07304d3c.png,bxblue is a Y Combinator backed (S17) Personal loan marketplace for pensioners and government workers with guaranteed income in Brazil. bxblue is taking this $80 billion market online.,bxblue,"DF, Brazil",bxblue is a marketplace for people with guaranteed income in Brazil.…,Acquired,,28,http://www.bxblue.com.br
"Kundan Kumar,Jose Sotelo,Alexandre de Brébisson",S17,,"B2B,Engineering, Product and Design",0,"Montreal, Canada",,Lyrebird offers a new generation of speech synthesis technologies for developers. It is the result of several months of research conducted at the MILA lab at University of Montréal.,Lyrebird,"Montreal, QC, Canada",Our tech speaks for itself.,Acquired,,13,https://lyrebird.ai/
"Nicholas Shekerdemian,Jeremy Hindle",S17,,"B2B,Recruiting and Talent",0,"London, United Kingdom",https://bookface-images.s3.amazonaws.com/small_logos/ac3d6ebaf0dfdd9434b6a3dd78182d498f7b6587.png,"Headstart (YC S17) uses Machine Learning technology to help employers identify the best-suited talent in the shortest period of time. We provide leading organisations with a solution designed to help them transition away from experience/qualification based screening and towards a more inclusive and effective process which considers personality, behaviours, strengths and motivations. In doing so, Headstart helps companies hire people truly aligned to their values, culture and exact job requirements in a seamless, engaging way.

The Headstart process is simple and effective: companies save time and money by finding candidates who meet their exact job requirements at an earlier stage, and job seekers connect directly with businesses through an engaging, reusable 15 minute application form. We ensure a transparent process and initiate productive dialogue, making candidates feel valued and helping companies hire the right people.",Headstart,"London, England, United Kingdom",Headstart uses Machine Learning to help companies decide on who to…,Acquired,machine-learning,44,https://www.headstart.io
"Oscar Merry,Jess Williams",S17,,"Consumer,Content",0,"London, United Kingdom",,Opearlo builds voice apps for Amazon Alexa and Google Assistant.,Opearlo,"London, England, United Kingdom",Opearlo produces voice apps for Amazon Alexa and Google Home.,Acquired,,2,https://www.opearlo.com
"Malthe Jørgensen,Simon Lind,David Kofoed Wind",S17,2015,Education,0,"Copenhagen, Denmark",https://bookface-images.s3.amazonaws.com/small_logos/2f1546920ba4bfb4d036c27d569684884be6f72d.png,Eduflow is a tool for running active online learning experiences. We are used at thousands of institutions around the world all the way from middle school to corporate training at Google. We believe that digital tools for learning need to be more than just a playlist of videos. We're building learning activities that instructors can use to engage learners and make them active participants in their own learning process.,Eduflow,"Copenhagen, Denmark",Create and run collaborative online learning experiences.,Acquired,education,12,https://www.eduflow.com
Bjoern Zinssmeister,S17,2017,"B2B,Security",0,San Francisco,https://bookface-images.s3.amazonaws.com/small_logos/388bf404240294f2fa8cff1b093bc8030dcd540c.png,"Developer-oriented security platform, helping small and large companies protect their software from malicious activityDeveloper-oriented security platform, helping small and large companies protect their software from malicious activity",Templarbit,"San Francisco, CA, USA",Protecting applications from malicious activity,Acquired,security,11,https://www.templarbit.com
"Anand Krishna,Atma Krishna,Dinesh Gadge",S17,2016,"Fintech,Payments",0,"Bengaluru, India",https://bookface-images.s3.amazonaws.com/small_logos/9237613d5c6b9ca86e68c4e86a6d63ec1d7337ed.png,"LotusPay was acquired by Juspay in Jan 2024.

LotusPay is the recurring payments solution for businesses in India. We enable our clients to quickly and easily collect payments directly from their user's bank accounts via paperless NACH Debit.

LotusPay is perfect for collecting loan repayments, membership fees, subscription and billing, recurring donations, tuition fees - any kind of regular or irregular payment, be it a fixed amount or variable amount.

LotusPay is backed by Y Combinator.",LotusPay,"Bengaluru, KA, India",Recurring payments solution for businesses in India.,Acquired,"fintech,payments",5,http://www.lotuspay.com
"Adam Gothelf,Brian Sloss,Paul Nichols",S17,2016,"Real Estate and Construction,Housing and Real Estate",0,San Francisco,https://bookface-images.s3.amazonaws.com/small_logos/9f8ee87d04d48a0045a44c4b65e0fa128713c03c.png,"Every year $1.2 trillion in residential home sales are exchanged, however buying and selling a house is still a huge, painful process. Maybe that’s because Real Estate is the least digital industry, behind only agriculture 🐮 . 

Disclosures.io is on a mission to make the real estate process more transparent and efficient for everyone involved. Our product helps sellers get their home to market faster and enables buyers to make more informed offers. 

We believe in lean, pragmatic product development, entrepreneurship and building a business that we are proud to be a part of. We love talking to like-minded makers, drop us a line!",disclosures.io,"San Francisco, CA, USA",The Complete Listing Toolkit for the New Era of Real Estate,Acquired,"documents,saas,b2b",10,https://disclosures.io
Umaimah Mendhro,S17,,"Consumer,Apparel and Cosmetics",0,San Francisco,,"VIDA is the story of the rich, beautiful, interconnected world in which we live. It is the story of contemporary life and of mindful, global citizenship.

VIDA is a collaboration amongst global citizens - from a designer in Milan, to a producer in Karachi, and a consumer in San Francisco – we are a global partnership of co-creators.

VIDA presents an alternative to the homogeneous, disposable products that increasingly dominate retail. We produce only that which is purchased, bringing into the world only items that are wanted.

We are using innovations in design and technology to make quality accessible again. We produce with the highest ethical standards, respecting the makers of the products we bring into our lives.

We believe beautiful products should create beauty every step of the way.",VIDA & Co.,"San Francisco, CA, USA",Platform for unique products produced on-demand at mass-scale,Acquired,"marketplace,manufacturing",11,http://www.shopvida.com
Nadav Hollander,S17,,"Fintech,Credit and Lending",0,San Francisco,https://bookface-images.s3.amazonaws.com/small_logos/0479f1b8e00c94eed03a224baddcff0558ef74df.png,Dharma is the only Ethereum wallet capable of seamlessly moving money between any US bank account and decentralized exchanges like Uniswap. The net result is a product that looks & feels like Coinbase on steroids — Download an App. Plug in your bank. Invest in the exponentially growing universe of tokens & yield opportunities in DeFi with a tap.,Dharma Labs,"San Francisco, CA, USA",The easiest way to buy 74k+ crypto tokens with USD,Acquired,"fintech,crypto-web3",14,https://dharma.io
