active_founders,batch,founded,industry,jobs,location,logo,long_description,name,region,short_description,status,tags,team_size,website
Matin Movassate,W13,2013,"B2B,Analytics",0,San Francisco,https://bookface-images.s3.amazonaws.com/small_logos/0be58a0e5449236d7f3e0dbb741e2aadde9e2881.png,Heap automates away the annoying parts of user analytics. No manual event tracking. No messy tracking plans. No custom ETL pipelines. Just insights. For everyone on your team.,Heap,"San Francisco, CA, USA",Captures user interactions with no code to generate analytics.,Acquired,"saas,analytics",388,https://heap.io/
Laks Srini,W13,,"B2B,Human Resources",0,San Francisco,https://bookface-images.s3.amazonaws.com/small_logos/73b18a9d2bccc67389f1f2004f80ff39d7f3f27e.png,"Zenefits was founded to take the administrative heartache out of getting healthcare. In the five years since, Zenefits'​ consumer-grade technology has tackled one of the economy's gnarliest people problems: delivering easy access to health insurance. 

Today, this is the foundation of our People Platform which brings everything HR -- benefits, payroll, onboarding and talent management -- into one single app. 

And we're just getting started. Our team is creating a modern People Platform that empowers employees by equipping them with the tools they need to be independent, mobile, and fully in control. 

The Zenefits People Platform is where HR comes to life. Learn more at www.zenefits.com",Zenefits,"San Francisco, CA, USA","HR for small businesses: onboarding, payroll and benefits.",Acquired,hr-tech,500,http://zenefits.com
"Taylor Brown,George Fraser",W13,2012,"B2B,Infrastructure",0,"Oakland, CA",https://bookface-images.s3.amazonaws.com/small_logos/d6b5710a13038fe1daa1421a986e1f4a7839a65a.png,"Fivetran automates data movement out of, into and across cloud data platforms. We automate the most time-consuming parts of the ELT process from extracts to schema drift handling to transformations, so data engineers can focus on higher-impact projects with total pipeline peace of mind. With 99.9% uptime and self-healing pipelines, Fivetran enables hundreds of leading brands across the globe, including Autodesk, Conagra Brands, JetBlue, Lionsgate, Morgan Stanley, and Ziff Davis, to accelerate data-driven decisions and drive business growth. Fivetran is headquartered in Oakland, California, with offices around the world. ",Fivetran,"Oakland, CA, USA",The leader in automated data movement,Active,"saas,b2b,analytics,data-engineering",1200,http://fivetran.com
"Chase Adam,Grace Garey",W13,2011,Healthcare,0,San Francisco,https://bookface-images.s3.amazonaws.com/small_logos/032dd510315da8e9725ccf64425c7a8d798fd100.png,We’re building technology to finance universal healthcare by crowdfunding surgeries and providing coverage for primary care.,Watsi,"San Francisco, CA, USA",Watsi is the first global crowdfunding platform for medical…,Active,"crowdfunding,healthcare",11,https://watsi.org
"Stephen Lake,Matthew Bailey,Aaron Grant",W13,,"Consumer,Virtual and Augmented Reality",0,"Kitchener, Canada",https://bookface-images.s3.amazonaws.com/small_logos/e598d38b27ed1203b3e155824bb2a55c1ba65e32.png,"Thalmic Labs is pioneering new ways of interacting with digital devices. With a mission to merge people and technology, the company is revolutionizing how we will interact with technology in the future. Its first product, the Myo™ armband, measures electrical activity in muscles to wirelessly control computers, phones and other digital technologies, resulting in seamless interaction between humans and devices.

Founded in 2012 by three graduates of the University of Waterloo's mechatronics engineering program (Stephen Lake, Matthew Bailey, Aaron Grant), Thalmic Labs has grown to a world-leading team of engineers, researchers, and creators committed to building the future of wearable technology. Thalmic Labs has raised over $140M USD to date from investors including Spark Capital, Intel Capital, Y Combinator, and others.",North,"Kitchener, ON, Canada",Wearable computing hardware: biosignal gesture recognition,Acquired,hardware,51,https://www.bynorth.com
"Joe Ariel,Joel Gillman,Trevor Stow,Vanessa Torrivilla",W13,2013,"Consumer,Food and Beverage",0,New York,https://bookface-images.s3.amazonaws.com/small_logos/cca9f25bb14498b6d14a86b02534da1a12502e50.png,"Goldbelly is an online platform for specialty food makers and artisans. We discover America's most unique handmade foods and ship them to your door, anywhere nationwide.",Goldbelly,"New York, NY, USA",Empowering restaurants and small food makers to ship nationwide.,Active,"marketplace,e-commerce",125,https://www.goldbelly.com/
Michelle Crosby,W13,,"Consumer,Home and Personal",0,"Bothell, WA",,"Wevorce is fixing divorce by ensuring kids come first, costs stay affordable, and the transition is appropriately paced, so that couples can focus on parenting, not fighting. 

For families, the Wevorce experience stands in stark contrast to the traditional adversarial approach. Instead of each spouse ""lawyering up,""​ Wevorce brings them together to work with a specially-trained attorney-mediator who guides the couple through a defined, but fully customized, settlement process. Additional experts in finance and parenting are brought in as needed to ensure the settlement g... See More",Wevorce,"Bothell, WA, USA",Changing divorce for good by making it a way less horrible experience…,Active,,11,http://wevorce.com
Denny Luan,W13,2012,"Healthcare,Healthcare Services",0,"Honolulu, HI",https://bookface-images.s3.amazonaws.com/small_logos/e0f7813d1a9c4de9bd2a7b0b88eaa3447db60df4.png,"Today's funders are so conservative they only fund the most obvious ideas. At Experiment, we fund the ideas that they won't fund; the ideas that matter.

Since founding, over 47,000 citizens have pledged $9 million dollars supporting 900 scientific projects on the platform. 46% of all projects on Experiment are successfully funded. When the projects are finished, the scientists share the scientific results with their backers as lab notes and peer-reviewed publications.

Scientists from Stanford, Harvard, and Yale have chosen to use Experiment instead of writing grants. Bill Gates recognized Experiment by saying ""this solution helps close the gap for potentially-promising but unfunded projects.""",Experiment,"Honolulu, HI, USA",crowdfunding platform for science,Active,marketplace,1,http://experiment.com
Vivek Shah,W13,2012,"Healthcare,Healthcare Services",5,San Francisco,https://bookface-images.s3.amazonaws.com/small_logos/abf7da0c7c74c34ef88b12b8b2f38161aac9adcb.png,"SimplyInsured was founded with one mission: to eliminate fear from health insurance. By changing the way small business owners purchase health insurance with our 100% online platform, we’re transforming a $20 billion dollar industry and delighting thousands of customers. 

Our unique values-based culture (and extremely talented team) is our core competitive advantage, and each person on our team makes a direct, immediate impact on our business. 

We value transparency, feedback, bias to action, growth, and an obligation to dissent. Every opinion is respected, we hold each other to extremely high standards, we’re driven by the diversity in our backgrounds, and unified by 100% alignment on our mission. 

What’s best for the customer is the heart of everything we do, and our customer stories prove it: by changing health insurance we’re literally saving lives. 

Based in San Francisco, SimplyInsured was founded in 2012 and is back by Bessemer Venture Partners, Polaris Ventures, and Y-Combinator. If you’re up for the challenge of improving health insurance for millions of Americans, we’re just getting started, and we’re growing!",SimplyInsured,"San Francisco, CA, USA",We sell health insurance to small businesses 100% online.,Active,health-insurance,35,http://simplyinsured.com
"Nick Tommarello,Greg Belote",W13,2011,"Fintech,Asset Management",6,San Francisco,https://bookface-images.s3.amazonaws.com/small_logos/86fe89dc40132aeb8f280105ad161eb9c7281ebc.png,"We help everyone invest in startups that they care about.

We believe that when all Americans can invest in innovation, the world will be a better place. And soon, our dream will become a reality. Thanks to the JOBS Act, everyone — not just the wealthy — can invest as little as $100 in the startups they care about. Not only does this open up the pool of investors, and increase the amount of great ideas that get funded, but it allows startups to grow an army of passionate investors who truly want to see them succeed. Second tier VC’s will become obsolete as startups tap their lead users and customers for quick early investments.",Wefunder,"San Francisco, CA, USA",We're Robinhood for pre-IPO startups. Everyone can invest $100.,Active,"fintech,investing",35,http://wefunder.com
Ryan Choi,W13,2012,"Consumer,Apparel and Cosmetics",0,New York,https://bookface-images.s3.amazonaws.com/small_logos/0b9e6ef382c45610608bd2bdb72d905cd6a41486.png,"StyleUp brings effortless joy to getting dressed with daily, weather-appropriate advice tailored to suit your life and style. It's your shortcut to chic.

We believe in discovery. It's our job to find outfit recommendations you love and deliver them to you conveniently and beautifully. Your feedback helps us make better recommendations, so we can serve you better every single day.",StyleUp,"New York, NY, USA","StyleUp brings effortless joy to getting dressed with daily,…",Inactive,fashion,2,http://thestyleup.com
"Adam Helybely,Zsolt Muller,Viktor Takacs",W13,,"B2B,Human Resources",0,"Sunnyvale, CA",,"Terascore is developing an educational tool for teachers to create, administer, and manage tests entirely online. Scores and results are available immediately and teachers get instant analytics on question quality, difficulty, student performance. Any questions created can be stored in a question bank for reuse.

Terascore aims to move all tests online and in doing so make learning more effective and teachers more efficient. The results are shortening the feedback loop for learning and are better for teachers and students.

Terascore makes creating tests radically easier, as it has a WYSIWYG browser-based test authoring tool. Terascore allows teachers to easily integrate images, links, and videos into tests to make them more fun, engaging, and relevant. The inclusion of mathematic equations is also supported.",Trainzen,"Sunnyvale, CA, USA",Educational assessments made easy. Eliminating paper-based exams in…,Inactive,"education,edtech",2,http://terascore.com
Iolanthe Stronger,W13,,"B2B,Supply Chain and Logistics",0,Palo Alto,,Kickstarter for physical products. Shop exclusive product launches.,Swish,"Palo Alto, CA, USA",Kickstarter for physical products.  Shop exclusive product launches.,Inactive,"hardware,e-commerce",2,http://swish.com
Umang Patel,W13,,"B2B,Finance and Accounting",0,Mountain View,,"PayTango is simple, modern invoicing.

No more dealing with spreadsheets, word processors, or entering data into complex and bulky invoicing software. Now you can quickly create beautiful PDF invoices and send them from anywhere.

Sign up at www.paytango.com",PayTango,"Mountain View, CA, USA",Simple invoicing,Inactive,"fintech,payments",2,http://paytango.com
"Ilter Canberk,Karan Sikka",W13,,"B2B,Engineering, Product and Design",0,Mountain View,,"Appcubator has launched to allow users to create their own web applications with drag and drop, text inserts and custom themes, rather than having to endure the arduous process of learning to create a full-functioning website or hire a contractor.",Appcubator,"Mountain View, CA, USA",The easiest way to prototype web applications.,Inactive,no-code,0,http://appcubator.com
Gautam Sivakumar,W13,,"Healthcare,Healthcare IT",0,San Francisco,,"Healthcare is broken and underserved by technology.

Hospital software is too complicated, too convoluted, and too disconnected. Doctors and nurses spend more time clicking through prompts than checking in on patients, and the quality of care suffers as a result. We're going to change that, and have been able to do so for the care teams of half a million patients and counting.",Medisas,"San Francisco, CA, USA",Medisas builds workflow & collaboration software for hospitals.,Inactive,"workflow-automation,healthcare",11,http://medisas.com
Lev Popov,W13,,"Consumer,Transportation Services",0,San Francisco,,"Real-time transit directions in San Francisco. Rover uses real-time public transit data to give you the best route, right now, to your destination. Always get the best route to your destination. Rover tracks all MUNI, BART, and Caltrain lines and gives you directions that make sense right now, so you don't have to wait or worry about missing a connection.

Currently supporting SF MUNI, BART, and Caltrain in the SF Bay Area.",RoverRide,"San Francisco, CA, USA",A universal urban transit app. Given all transportation options…,Inactive,"transportation,mobility",0,http://ride.roversf.com
Josh Mangel,W13,,"B2B,Retail",0,"Atlanta, GA",,"Beatdeck is a big data music analytics platform. It is used to evaluate artist's KPM, analyze social signals, and provide a clean extensive dashboard into the music industry. Beatdeck was founded in January 2013 at Y Combinator in Mountain View, CA by Josh Mangel and Avi Zolty.",BeatDeck,"Atlanta, GA, USA","Music, Metrics... Meritocracy. 
(Upload Music, Connect your Social…",Inactive,social-media,2,http://beatdeck.com
"Neel Murthy,Nitin Shantharam",W13,2013,"Consumer,Home and Personal",0,San Francisco,https://bookface-images.s3.amazonaws.com/small_logos/a1a9e0bde0c50e6f137568c94d83ae57e575c86e.png,"Send and receive packages with Swapbox

# Receive packages with Swapbox #

Prevent missed deliveries with Swapbox. We give you control over your packages — no more missed delivery notices or stolen packages. Shop online and ship packages to a Swapbox. We'll notify you via email and/or text message with the pickup details when they arrive.

Learn more: swapbox.com/faq 
Receiving deliveries video: https://vimeo.com/76379214

# Send packages with Swapbox #

Take anything that you want to ship to your local Swapbox, no planning ahead necessary. Enter a few details about where your item is being shipped and how fast you want it there. Place your item in the Swapbox (It doesn't even need to be packaged!), and Swapbox will take care of the rest. Swapbox ships via UPS, USPS or FedEx. Swapbox is the fastest, most convenient way to ship anything.

Learn more: swapbox.com/shipping 
Shipping video: https://vimeo.com/97379917",Swapbox,"San Francisco, CA, USA",Stop missing deliveries. Ship to Swapbox and pick up at our kiosks.,Inactive,"delivery,logistics,e-commerce",2,http://swapbox.com
"Shri Ganeshram,Rujul Zaparde,Kevin Petrovic",W13,,"Consumer,Travel, Leisure and Tourism",0,San Francisco,,"Launched in early 2013 and based in San Francisco, California, FlightCar inspires and enables local owners and visitors to come together to list and rent each other’s unique vehicles. We make it convenient and enjoyable for anyone to experience traveling in an original way at a great value. By connecting visitors who need cars at the airport with locals looking to park them, FlightCar saves travelers money, creates a more interesting experience, and offers a practical and novel new option for a collaborative community of travelers.

The company has raised a total of $40.41 million from prominent investors including GGV Capital, General Catalyst Partners, First Round Capital, Softbank Capital, The Priceline Group, Tencent Holdings, and Brian Chesky, CEO and Co-Founder of Airbnb.

Currently operating in 12 airports nationwide:
AUS, BOS, DEN, DFW, EWR, IAD, LAX, OAK, SAN, SEA, SJC, SFO",FlightCar,"San Francisco, CA, USA","FlightCar is the Airbnb of Car Rentals at Airports.
We allow people…",Inactive,marketplace,51,http://flightcar.com
Jared Heyman,W13,2012,"Healthcare,Healthcare Services",0,San Francisco,https://bookface-images.s3.amazonaws.com/small_logos/c17deab73292015be62a5d49331aa6dd3156d844.png,"CrowdMed is an innovative healthcare startup harnessing the wisdom of crowds to help solve complicated medical cases more quickly and efficiently. The company offers individuals, insurance providers, and self-insured corporate customers the ability to reduce their healthcare costs without compromising care. Based in San Francisco, CA, CrowdMed is backed by NEA, Andreessen Horowitz, Greylock Partners, SV Angel, Khosla Ventures and Y Combinator. The company's advisors have founded and run some the world’s most successful online healthcare companies including WebMD. CrowdMed graduated from Y Combinator's Winter 2013 class, and was officially launched during the TEDMED 2013 conference in Washington DC. Visit www.crowdmed.com for more information.",CrowdMed,"San Francisco, CA, USA",CrowdMed harnesses the wisdom of crowds to solve difficult medical…,Inactive,consumer-health-services,5,http://www.crowdmed.com
"Kuy Mainwaring,Eugene Yaroslavtsev",W13,,"B2B,Infrastructure",0,San Francisco,,"Logiblock makes electronic product development faster for startups and established firms alike. Logiblock is the client services division of Outbreak, Inc. Founded as a technology research and development group in 2008, Outbreak primarily develops and licenses embedded software technology.",Logiblock,"San Francisco, CA, USA",Logiblock engineers electronics and development tools to dramatically…,Inactive,"hardware,iot,manufacturing",0,http://logiblock.com
"Bob Schafer,John Stanley",W13,,"B2B,Recruiting and Talent",0,San Francisco,,"Prophecy is quantifying the cognitive factors that determine workplace performance -- from mental aptitude, to personality traits, to decision-making styles and interpersonal dynamics.  Drawing from research across many subfields of neuroscience, we have created a suite of cognitive tests that integrate behavioral measures with sensors for collecting biosignals.  The data we collect is unlike that of any existing personality or aptitude test, and gives us the unique ability to predict a tremendous number of traits, characteristics, and job performance measures.  We help employers find the ideal person for a job, and we help managers optimize and motivate their teams.",Prophecy Sciences,"San Francisco, CA, USA",Predicting workplace performance through neuroscience,Inactive,neurotechnology,2,http://prophecysciences.com
"Merrill Lutsky,Erik Schluntz",W13,,"B2B,Retail",0,"Cupertino, CA",,"Posmetrics provides innovative iPad-based customer feedback surveys that collect orders of magnitude more data than other technologies, provide relevant, real-time results, and generate actionable recommendations to help businesses and organizations improve their services.",Posmetrics,"Cupertino, CA, USA",Ultra-short feedback surveys on tablets mounted in businesses. Higher…,Inactive,analytics,2,http://posmetrics.com
"Jonathan Downey,Brad Schiller",W13,,"Industrials,Drones",0,San Francisco,,"Airware offers commercial drone solutions, enabling enterprises to take full advantage of aerial data for any business application. Airware’s solutions combine hardware, software, and cloud services to enable companies to efficiently manage and safely and reliably operate commercial drones at scale.",Airware,"San Francisco, CA, USA",Airware provides end-to-end solutions that enable enterprises to…,Inactive,"drones,enterprise",51,http://airware.com
Viral Bajaria,W13,,"B2B,Analytics",0,San Francisco,,"6sense's mission is to empower marketing and sales teams with 100 percent visibility into buyers; who they are, needs and timing. 6sense provides marketers with omni-channel connectivity and visibility from brand to demand to revenue. 6sense's patent-protected predictions power all downstream sales and marketing systems with intelligence on who is in an active buying cycle, what products, when they will buy and where they are in the buyer's journey. 6sense enables intelligent growth resulting in new pipeline, higher marketing to sales conversions, larger opportunity size and increased sales productivity and effectiveness with teams focusing on the right buyers with a need now.

Visit us at: http://www.6sense.com/

Learn more about us at http://www.6sense.com
Keep up to date on industry trends by following us on Twitter: @6SenseInc",GrepData,"San Francisco, CA, USA",Big Data Analytics,Acquired,analytics,51,http://grepdata.com
"Vishal Kapur,Jahanzeb Sherwani,Jason DiCioccio,Faraz Khan",W13,,"B2B,Productivity",0,Mountain View,,"Screenhero lets you screen share any application with anyone, no matter where they are. It's super simple and blazing fast. You each get your own mouse pointer, and you're both always in control. It's designed for collaboration, not just broadcasting your screen. It's like Google Docs for any application on your computer.",Screenhero,"Mountain View, CA, USA","Collaborative Screen Sharing — you each get your own mouse, and…",Acquired,"team-collaboration,collaboration",2,http://screenhero.com
Anton Vaynshtok,W13,,"B2B,Productivity",0,San Francisco,,"The easiest way for companies to connect their empoyees to the apps they need.

Meldium is a YC-backed startup helping teams & companies manage accounts & passwords for cloud apps. From shared passwords to user provisioning, Meldium is a central dashboard that connects to every cloud app and makes it simple to create, edit and remove user accounts across all of them. All without IT.",Meldium,"San Francisco, CA, USA",Simple password & identity management for teams. Acquired by LogMeIn…,Acquired,"security,enterprise",2,http://meldium.com
"Amitav Chakravartty,Anirban Bardalaye",W13,2011,"Consumer,Travel, Leisure and Tourism",0,San Francisco,https://bookface-images.s3.amazonaws.com/small_logos/a3ed8ebe374e674c6e6ada00d5e688a2f0309455.png,"VaycayHero takes the hassle out of booking vacation rentals. All rentals are verified, and 100% accurate, and calendars and pricing are automatically updated. This means, no surprises, ever. Search and book online hassle-free, or chat with a booking concierge if you need help. VaycayHero has vacation rentals in major vacation destinations in the US and Mexico. It built a travel hub platform to distribute the rentals to multiple channels including Vaycayhero.com and powered many marketplaces to provide a hassle-free booking experience.",VaycayHero,"San Francisco, CA, USA",VaycayHero is a marketplace of professionally managed vacation…,Acquired,"marketplace,saas,travel",55,https://www.vaycayhero.com/
"Daniel Lopez,Erica Brescia",W13,,"B2B,Infrastructure",0,San Francisco,,"Packaged Applications for Any Platform. 

Bitnami has automated the ability to package, deploy and maintain applications, lowering the barrier to adoption for anyone to deploy and maintain a full spectrum of server applications, development stacks and infrastructure applications in virtually any format.

Simply click to deploy any one of 120+ ready-to-run applications from the Bitnami Application Catalog or use Bitnami Stacksmith to package and migrate your custom in-house applications to the cloud.

For more information, visit www.Bitnami.com, or follow us on Twitter (@Bitnami) and Facebook.",Bitnami,"San Francisco, CA, USA",The App Store for Server Software,Acquired,developer-tools,75,https://bitnami.com
Reshma Khilnani,W13,,"Healthcare,Healthcare IT",0,San Francisco,https://bookface-images.s3.amazonaws.com/small_logos/4d244dae097f5be7af6d767af0db5cf4f74fbd57.png,"MedXT is the easiest way to manage medical images online.  We make it easy for medical professionals to access and share their medical data safely and securely.  We provide specialty tools such as RIS, PACS, and HL7 connectivity. The MedXT platform will power your imaging center, hospital radiology department, or radiology group. Learn more at https://www.medxt.com",MedXT,"San Francisco, CA, USA","Radiology in the cloud.  X-rays, CAT scans, MRI's, and…",Acquired,"health-tech,medical-devices",2,http://medxt.com
"Karthik Balakrishnan,Kanishk Parashar",W13,,"Fintech,Consumer Finance",0,San Francisco,,"Coin is a consumer electronics and financial technology company bringing simplicity and security to payments. Through the Coin developer program, wearables makers now have a turnkey solution for integrating secure payments into their devices (e.g. fitness trackers, smartwatches, jewelry). Follow the company on Twitter @coin or learn more about the Coin developer program at http://developer.onlycoin.com.

Coin 2.0 smart payment device
Coin 2.0 is a secure smart device that has the form factor of a credit card, but it holds your cards in one - including your credit, debit, gift and loyalty cards. Coin 2.0 lets you swipe or tap your cards at millions of merchants across the USA. Coin 2.0 has 80%+ compatibility, partly because we use cutting-edge technology that has not yet been integrated into all point-of-sale systems. We encourage customers to carry a “backup card” given the wide variety of sales registers in the USA. While Coin 2.0 shares the same form factor as a credit card, it features enhancements such as an electronic display and a single button to allow for simple switching between different cards. With over-the-air updates, Coin 2.0 adapts to evolving payment technology, offering future-ready ubiquity in a small and powerful package. Coin's security features also keep your information safe. Auto-unlock means that only you can use your Coin 2.0 while Last Known Location helps you find your Coin 2.0 in case of loss or theft. Coin 2.0 is designed for use in the USA. To verify identify, a Social Security Number is required.

Website: https://onlycoin.com
Video: https://youtu.be/gJBZMUuhUrw",Coin,"San Francisco, CA, USA",A mobile wallet that allows you to pay everywhere credit cards are…,Acquired,payments,11,http://onlycoin.com
