active_founders,batch,founded,industry,jobs,location,logo,long_description,name,region,short_description,status,tags,team_size,website
"Walker Williams,Evan Stites Clayton",W13,,"Consumer,Apparel and Cosmetics",0,San Francisco,https://bookface-images.s3.amazonaws.com/small_logos/af499c0e78027f9e308cada3ac407751298eb966.png,"About Teespring
Millions of people use Teespring to turn their unique ideas into high-quality products. When you shop on Teespring, you’re supporting one of the independent creators in our community, as well as the causes they care about. Every product you’ll find here is made-to-order with satisfaction and quality guaranteed. That means that you get a custom product that was made for you. Headquartered in San Francisco, Teespring is venture-backed by Andreessen Horowitz, Khosla Ventures, and Y Combinator. For more information visit www.Teespring.com.",Teespring,"San Francisco, CA, USA",IMPORTANT: The original YC founders are no longer involved with this…,Acquired,"marketplace,e-commerce,retail",201,http://teespring.com
"Danny Castonguay,Dexter Ligot-Gordon,Paul Rivera",W13,2013,"B2B,Operations",0,"Makati, Philippines",https://bookface-images.s3.amazonaws.com/small_logos/6c8f5c4943929604147699496cec762e6182921b.png,"Kalibrr operates a two-sided job marketplace in Southeast Asia with over 5,000,000 high-skill white collar talents primarily in the Philippines and Indonesia. 

With Kalibrr, you can recruit and build a remote sales, product, engineering or design team in the Philippines within minutes",Kalibrr,"Makati, NCR, Philippines",Kalibrr connects SEAsian talent to your local & global jobs.,Acquired,recruiting,51,https://www.kalibrr.com
"Vinoth Gopi,Sivamani Varun",W13,2012,"B2B,Retail",0,San Francisco,https://bookface-images.s3.amazonaws.com/small_logos/5307a5e46c396120f6ef685a303ed74085ff242c.png,"Our products:
- Data APIs/Feeds (Retail feeds, UPC lookups, Keyword search)
- AI APIs (Categorization, Attribute extraction/NER, Matching)
- Dashboards (Analytics reports, Price monitoring)

We offer enterprise solutions for:
- E-commerce Marketplaces (catalog generation & enrichment, seller on-boarding)
- Logistics (HTS/tariff classification, attribute enrichment)
- Brands (market share & trend reports, price monitoring)",Semantics3,"San Francisco, CA, USA",Data and AI platform for Ecommerce & Cross-Border Logistics,Acquired,"artificial-intelligence,logistics,e-commerce",25,http://www.semantics3.com
"Humberto Evans,Mike Robbins",W13,2012,"B2B,Engineering, Product and Design",0,"Redwood City, CA",https://bookface-images.s3.amazonaws.com/small_logos/c463a769b2f58faee6f5bc842ce70bb66f0acc66.png,"CircuitLab makes it easier for electrical engineers, students, and electronics hobbyists to design, analyze, build, and share electronic circuits.",CircuitLab,"Redwood City, CA, USA",Online circuit simulator and electronic schematic editor.,Active,"hardware,saas",2,https://www.circuitlab.com/
"David Petersen,Jiyan Wei",W13,2013,"Consumer,Home and Personal",0,San Francisco,https://bookface-images.s3.amazonaws.com/small_logos/fa4cae75b1ea33cb97e24469d7bae5435b230e2f.png,"BuildZoom is a better way to remodel. We connect homeowners to the most reliable general contractors in their area and make remodeling simpler, cheaper and more predictable.  

Our technology harvests public data on every licensed contractor in the United States, including license information, building permits, bond and insurance information and other government records. We use this public data along with private data gleaned from past BuildZoom marketplace interactions to evaluate contractor quality, availability, and fit for each construction project. Our goal is to help project owners arrive at several competitive bids from highly qualified and experienced construction companies to ensure a fair price and a successful project.

We build tools to help contractors look their best online, manage their lead pipeline, seamlessly interact with project owners, and compose professional bid proposals.",BuildZoom,"San Francisco, CA, USA",BuildZoom is a better way to remodel. We connect homeowners to the…,Active,"real-estate,construction",100,https://www.buildzoom.com
Lior Abraham,W13,,"B2B,Analytics",0,"Redwood City, CA",https://bookface-images.s3.amazonaws.com/small_logos/75095731e25d34e505b54386e1fbac0016ef69ea.png,"Interana is the fast and scalable event-based analytics solution to answer critical business questions about how customers behave and products are used. Interana allows users to analyze and explore the key business metrics that matter most in a data-driven world – such as growth, retention, conversion and engagement – in seconds, rather than the hours or days it often takes with existing solutions. Interana allows customers to discover and investigate these key insights easily through its visual and interactive interface, which makes data analysis a natural extension of everyone’s workflow.",Scuba,"Redwood City, CA, USA",Hadoop for impatient people.,Active,"analytics,big-data",51,https://www.scuba.io
Nitesh Goel,W13,2012,"B2B,Productivity",0,San Francisco,https://bookface-images.s3.amazonaws.com/small_logos/645d902ed813d617206c22ce485d48419ccb91c1.png,"We are easily bored. It's the one thing that unites humanity in 2020. No one wants to read twenty paragraphs of text, or sit through forty verbose slides. Yet, we keep making them, boring everyone out of their minds.

We are building more beautiful and fun alternatives to traditional documents. They're less of a pain-in-the-ass to create, and a lot less waterboard-y to view.

Checkout a Padlet timeline (https://padl.et/timeline), or a Padlet map (https://padl.et/map) to see what we're talking about. 

Over ten million people all over the world use Padlet. Most satisfyingly, for millions of kids, Padlet is their first experience of creating things on the Internet.

People say we are improving education. People say we are making them more creative. People say a lot of things.",Padlet,"San Francisco, CA, USA",Papyrus → Parchment → Paper → Padlet,Active,"education,saas",40,https://padlet.com
Nikhil Nirmel,W13,,"Consumer,Home and Personal",0,New York,,"Lawdingo gets people in touch with a lawyer very quickly.

Lawdingo gives people seeking legal services direct access to independent lawyers who can help them. Such attorneys usually have more flexible hours, lower rates, and greater interest in customer service than to their larger firm counterparts. The problem is that there is so many such lawyers; how is someone supposed to figure out who is right for them, and who has some time to take on their case? Fair question. Coincidentally, we started Lawdingo to answer just that. 

If you're looking for a lawyer, we encourage you to try finding an easier way to get one to work for you. If you are a lawyer working in solo or small practice, we encourage you to find a more effective way to grow your law practice. 

We also encourage you not to take our word for it. Read what Solo Practice University, the ABA Journal, FindLaw, AboveTheLaw, TechCrunch, Lifehacker, and others say about us. This isn't some fly-by-the-night company. This is the future of the legal industry. We hope you'll get in touch. 

Lawdingo was started by Nikhil Nirmel (nikhil@lawdingo.com), an entrepreneur with a background at Yelp and Wharton Undergrad, and Dan Langevin , a ridiculously talented technologist who was formerly CTO of Lifebooker. Lawdingo has backing from Y Combinator and other investors.",Lawdingo,"New York, NY, USA",Lawdingo provides virtual paralegal services to law firms.,Active,legaltech,,http://lawdingo.com
"Paul Dix,Todd Persen",W13,2012,"B2B,Infrastructure",0,San Francisco,https://bookface-images.s3.amazonaws.com/small_logos/52f8bfabfa73534a4e180ab67b04914310f2a95e.png,"InfluxData, the creators of InfluxDB, delivers a modern Open Source Platform built from the ground up for analyzing metrics and events (time series data) for DevOps and IoT applications. Whether the data comes from humans, sensors, or machines, InfluxData empowers developers to build next-generation monitoring, analytics, and IoT applications faster, easier, and to scale delivering real business value quickly. Based in San Francisco, InfluxData customers include Autodesk, Cisco, eBay, and Coupa. Visit https://www.influxdata.com.",InfluxData,"San Francisco, CA, USA",The platform for building and operating time series applications.,Active,"analytics,open-source,time-series,databases",210,https://influxdata.com
Na'ama Moran,W13,,"B2B,Retail",0,San Francisco,https://bookface-images.s3.amazonaws.com/small_logos/bce697e8c30a87349848e4fe7b038193a706d63b.png,,Cheetah,"San Francisco, CA, USA","Fastest, easiest, and most affordable way for small business owners…",Active,"logistics,supply-chain",2,http://gocheetah.com
"Teng Bao,Dafeng Guo,David Haisha Chen",W13,2012,"B2B,Marketing",0,"Shanghai, China",https://bookface-images.s3.amazonaws.com/small_logos/045dc2771d5bced4ae0b64cde731aa40775048cf.png,"Strikingly lets you build a gorgeous, mobile optimized website in minutes. For your business, organization, or personal branding, a good-looking site is necessary for your online legitimacy in the Mobile Age.

With no code or design at all, you can set up a professional website in under 30 minutes, and it'll look great on your phone, tablet, and computer. Check it out at http://www.strikingly.com/. We're hiring! Please see: http://www.strikingly.com/s/careers .

Our mission is to give everyone the power to turn their creative ideas into reality and build brands around them. See why: http://www.strikingly.com/s/manifesto",Strikingly,"Shanghai, Shanghai, China","The easiest way to create a beautiful, mobile optimized website.",Active,,99,https://www.strikingly.com
Christian Romming,W13,,"B2B,Infrastructure",6,San Francisco,https://bookface-images.s3.amazonaws.com/small_logos/07c9b19241da3d7897596f5f34b6c9baa7c7518e.png,"Etleap is an ETL solution for creating perfect data pipelines from day one. Unlike other enterprise solutions, Etleap doesn’t require extensive engineering work to set up, maintain, and scale. It automates most ETL setup and maintenance work, and simplifies the rest into 10-minute tasks that analysts can own.",Etleap,"San Francisco, CA, USA",Etleap is an ETL solution for creating perfect data pipelines. ,Active,data-engineering,11,https://etleap.com
Fei Deyle,W13,,"Consumer,Apparel and Cosmetics",0,Mountain View,,"Lollipuff is the only online auction site that pre-screens each and every item to guarantee the authenticity of its high-end, pre-owned designer apparel and accessories.

Buyers can be confident they're getting the real deal, and sellers never have to worry about listing their luxury pieces alongside counterfeits. Combining the buyer security of an upscale boutique with the amazing prices of an online auction, Lollipuff is the go-to site for authentic, affordable and on-trend designer fashion.",Lollipuff,"Mountain View, CA, USA",Online Auctions for Authentic (Women's) Designer Goods,Active,"marketplace,e-commerce,fashion",11,http://lollipuff.com
Spencer Hewett,W13,,"B2B,Retail",0,New York,,"RADAR is a platform that combines RFID and computer vision to automate and augment retail store processes. Our technology offers unprecedented speed and location accuracy, which allows stores to:

1) Manage inventory efficiently, through automated inventory counts, improved in-store replenishment and instantaneous customer stock checks

2) Eliminate checkout lines altogether through our autonomous checkout tool.

3) Measure all customer-product interactions, giving physical stores the same insight into consumer behavior and product performance as online stores.

https://goradar.com",RADAR,"New York, NY, USA",RADAR is building technology to completely transform the in-store…,Active,"artificial-intelligence,retail-tech",46,https://goradar.com
