active_founders,batch,founded,industry,jobs,location,logo,long_description,name,region,short_description,status,tags,team_size,website
"Sid Sijbrandij,Dmytro Zaporozhets",W15,2012,"B2B,Engineering, Product and Design",0,San Francisco,https://bookface-images.s3.amazonaws.com/small_logos/af0d32f65e9007b7edbde422787633e338fa9bff.png,"GitLab is the first single application for the entire DevOps lifecycle. Only GitLab enables Concurrent DevOps, unlocking organizations from the constraints of today’s toolchain. GitLab provides unmatched visibility, radical new levels of efficiency and comprehensive governance to significantly compress the time between planning a change and monitoring its effect. This makes the software lifecycle 200% faster, radically improving the speed of business.

GitLab and Concurrent DevOps collapses cycle times by driving higher efficiency across all stages of the software development lifecycle. For the first time, Product, Development, QA, Security, and Operations teams can work concurrently in a single application. There’s no need to integrate and synchronize tools, or waste time waiting for handoffs. Everyone contributes to a single conversation, instead of managing multiple threads across disparate tools. And only GitLab gives teams complete visibility across the lifecycle with a single, trusted source of data to simplify troubleshooting and drive accountability. All activity is governed by consistent controls, making security and compliance first-class citizens instead of an afterthought.

Built on Open Source, GitLab leverages the community contributions of thousands of developers and millions of users to continuously deliver new DevOps innovations. More than 100,000 organizations from startups to global enterprise organizations, including Ticketmaster, Jaguar Land Rover, NASDAQ, Dish Network and Comcast trust GitLab to deliver great software at new speeds.",GitLab,"San Francisco, CA, USA",A complete DevOps platform delivered as a single application.,Public,"developer-tools,devsecops,open-source",2000,http://gitlab.com/
Mike Xu,W15,2014,"B2B,Supply Chain and Logistics",0,San Francisco,https://bookface-images.s3.amazonaws.com/small_logos/a10cd6dd027a6f9927f0c0574be6404d3ed0c014.png,"GrubMarket is the AI-powered technology enabler and digital transformer of American Food Supply Chain industry. Our mission is to build and provide the eCommerce and software technologies to this industry, to transform this completely offline and highly manual industry into modernized online industry powered by software technologies, and improve the efficiency of American food supply chain.
",GrubMarket,"San Francisco, CA, USA",AI-powered technology enabler and digital transformer of American…,Active,"e-commerce,supply-chain,food-tech,agriculture",4548,http://grubmarket.com
Debkishore Mitra,W15,,"Healthcare,Diagnostics",0,"Emeryville, CA",https://bookface-images.s3.amazonaws.com/small_logos/c16f624e7c7aac96877a792583de496fc66b4a02.png,"Diassess Inc. is revolutionizing the way infectious diseases are prevented, diagnosed, and monitored by developing the tools necessary to empower people to become knowledgeable about their health. We produce inexpensive, disposable health diagnostic hardware that transforms any smartphone into a portable, real-time health-monitoring device for rapid, accessible, multiplexed analysis of bodily fluids anywhere in the world.",Lucira Health,"Emeryville, CA, USA",Next generation infectious disease test kits,Public,"health-tech,diagnostics",43,https://www.lucirahealth.com/
"Matthew De Silva,Pete Quinzio",W15,2014,"Healthcare,Diagnostics",3,"Foster City, CA",https://bookface-images.s3.amazonaws.com/small_logos/c2bf47d120c3bdde2a9ad11d9f05f1c08a72ca0e.png,"Notable Labs is building a personalized drug discovery platform to identify treatment options for relapsed and refractory cancer patients — starting with blood cancer — to address the long tail of cancer treatment. We look at a person’s actual cancer cells, test combinations of FDA approved drugs, and see which combinations kill the cancer cells and leave the healthy cells alive. We focus on combinations because cancer is often difficult to target with just one drug and starting with a single drug can lead to resistant clones or relapse. We're building a highly automated lab in Foster City running on our custom software and are currently testing relapsed/refractory cancer patients as well as samples from a variety of pharma/biotech partnerships.

https://www.notablelabs.com/careers",Notable Labs,"Foster City, CA, USA",Personalized drug discovery for blood cancer.,Public,"biotech,drug-discovery,oncology",40,http://notablelabs.com
"Brad Siegler,Jeff Lowe,Jabbok Schlacks,William Schlacks",W15,2014,"Real Estate and Construction,Construction",3,"Columbia, MO",https://bookface-images.s3.amazonaws.com/small_logos/ad05853522c217d92c372ba8883ff6b45dd83d99.png,"EquipmentShare delivers cloud solutions for the construction industry. We provide a better equipment rental experience, fleet tracking software and hardware security solutions to help contractors work smarter. ",EquipmentShare,"Columbia, MO, USA",Cloud solutions for the construction industry.,Active,,5400,https://www.equipmentshare.com
"Shashank Kumar,Harshil Mathur",W15,2014,"Fintech,Payments",3,"Bengaluru, India",https://bookface-images.s3.amazonaws.com/small_logos/b6a6aaf9a84fa4b7ddb53cabda7443c142a5a154.png,"The journey of building Razorpay started in 2014, when Harshil Mathur (CEO & Co-Founder) and Shashank Kumar (MD & Co-Founder) witnessed the dismal state of the online payments industry in India then and understood that they have a larger and more important issue to solve. And That was democratizing online payments for Indian businesses, particularly the underserved market, Startups and SMEs. Over the last 9 years, Razorpay has evolved from a single-product company to a multi-product company, from an online payment gateway to India’s only full-stack financial solutions company, offering payments and banking solutions to businesses.  Razorpay today is transforming age-old complexities and changing every known paradigm of money movement for disruptive businesses.

Over the last couple of years, Razorpay’s growth has evolved to be an index of India’s digital economy. From a kirana shop in Kashmir collecting payments on our POS device to a textile exporter in Kanyakumari accepting dollars through our International Payments product, Razorpay has revolutionised how businesses have traditionally transacted and interacted with money. 

Razorpay became the first and only Indian fintech to build a full-stack international Payment Gateway ‘Curlec by Razorpay’ and evolved into a comprehensive provider of payment solutions, leveraging the synergy between cutting-edge technological capabilities and a profound understanding of the local payment ecosystem. The introduction of the new Curlec Payment Gateway aims to cater to a wide spectrum of businesses, expanding its reach to over 5,000 establishments. 

Be it for international expansion or solving for Indian businesses, for Razorpay, the customer has always been at the core of all disruption, from addressing evolving needs to delivering new solutions. This hyperfocus helped bring Razorpay’s several industry-first innovations into the market since 2014. Razorpay became the first to launch a completely digital on-boarding process for startups, first to launch support for UPI, first to launch support for Bharath QR, first to introduce recurring payments for businesses through Razorpay Route, automating payment receipts and later automate payouts and making the entire process seamless and optimized and many more were introduced aling the way. Other firsts include: - First to launch India’s Multi-Network Tokenisation solution, TokenHQ - Razorpay became India’s first payment gateway to support credit cards on UPI - Razorpay also became India’s largest omnichannel payment gateway for businesses post acquiring Ezetap which is India’s leading offline POS company that was founded with the aim to simplify the in-person offline payments experience.

Over the years, Razorpay’s valuation has jumped from $1 billion to $7.5 billion and has added a host of marquee investors to its captable. Razorpay is also the second Indian company to be a part of Silicon Valley’s largest tech accelerator, Y Combinator. Marquee investors such as Lone Pine Capital, Alkeon Capital, TCV, GIC, Tiger Global, Sequoia Capital India, Ribbit Capital, Matrix Partners, Salesforce Ventures, Y Combinator, and MasterCard have invested a total of $741.5 Mn through Series A, B, C, D, E and F funding. The last financing round of Series F led the company’s valuation to $7.5 Billion signaling one of the fastest increases in valuation for an Indian Unicorn. 

Razorpay has also made acquisitions with like-minded companies over the last 9 years. In total, till date, Razorpay has made eight acquisitions, Billme in 2023 - A Digital invoice and customer Engagement, Ezetap in 2022 - India’s leading offline POS company, PoshVine in 2022 - India’s leading loyalty and reward management platform, IZealiant in 2022 - A mobile-first, API-enabled, and cloud-ready payment solution and made its first international foray in South-East Asia by announcing its acquisition of Curlec in 2022 - A recurring payments platform. TeraFin Labs in 2021 - the AI-based SaaS platform that facilitates digital financing solutions, Opfin (Now RazorpayX Payroll) in 2019 -  The payroll management solution and Thirdwatch in 2019, the first acquisition - The AI-powered fraud detection platform.

All these efforts are being done in collaboration with banks, regulators, and stakeholders so that India can build a better place for small and big businesses. Today, Razorpay powers online payments for 76 Of 100 startup unicorns and millions of businesses in India. The core premise of what Razorpay was founded in 2014 and what it is today hasn’t changed. It is to make money movement simpler and easier, whether it is for businesses to receive money, send money, or manage money. 

",Razorpay,"Bengaluru, KA, India",India's only full-stack financial solutions company for businesses.,Active,"banking-as-a-service,fintech,payments",2700,https://razorpay.com
Jose M. Mejia Oneto,W15,2015,"Healthcare,Drug Discovery and Delivery",0,San Francisco,https://bookface-images.s3.amazonaws.com/small_logos/ffc67fc2138abb0d2b24dd42fa7b056c024ad80a.png,"Shasqi is leading the development of therapeutics leveraging click chemistry to get active cancer treatments to tumors with its proprietary CAPAC™ platform. Our technology is based on localizing a click chemistry reagent in the tumor area, which then activates a second agent, a systemically infused protodrug. When the two 'click', a powerful localized therapy is activated at the tumor, while keeping its systemic exposure levels below toxic thresholds.",Shasqi,"San Francisco, CA, USA",Pioneering Click Chemistry in Humans to change cancer outcomes,Active,"biotech,therapeutics",28,https://
Eugenia Kuyda,W15,,"Consumer,Content",0,San Francisco,https://bookface-images.s3.amazonaws.com/small_logos/8bb8d74afb0e05a227b84f8652f03f05258ec34b.png,"Luka is a software development company based in San Francisco, California.

The company created Luka app, a new messenger with AI-powered chatbots. They help you find places to eat, do web search, make plans together, pick places to eat, play trivia games and lots of other things in a messenger.

In 2016 Luka launched a closed testing of Replika, a new app that allows to create a personal AI friend that helps people deal with loneliness. The app is powered by a proprietary deep learning architecture.",Replika,"San Francisco, CA, USA",Replika is an AI friend that you can talk to designed to make you…,Active,"mental-health,conversational-ai",28,https://replika.ai/
Talha Sattar,W15,2015,"Healthcare,Consumer Health and Wellness",4,"Redwood City, CA",https://bookface-images.s3.amazonaws.com/small_logos/3ef7a61ca3801604838ec463e1179fb823f2670c.png,"We enable people to live their best lives. As we succeed, there is more convenience, healthier communities and thriving businesses. We get medications to those who need them and improve information, access and management of their care and enable businesses to move online and gain access to consumers who need their services 
",NimbleRx,"Redwood City, CA, USA",On-demand prescription delivery.,Active,saas,130,http://nimblerx.com
"Mukul Dhankhar,Abhinai Srivastava",W15,2014,"B2B,Retail",4,Palo Alto,https://bookface-images.s3.amazonaws.com/small_logos/bd7ff2b3db9bbbc82a79afababdad873d16b6e54.png,"Mashgin creates better retail experiences through visual automation. 

We’ve built a self-checkout kiosk that uses computer vision to scan multiple items without barcodes, reducing checkout time by 10x. We’re completely recreating the checkout experience in an industry that’s had little innovation in decades.

Our clients see dramatic reductions in lines and revenue increases of as much as 400% as a result.",Mashgin,"Palo Alto, CA, USA",Self-Checkout using Computer Vision.,Active,"cashierless-checkout,deep-learning,hardware,computer-vision,ai",75,http://mashgin.com
Galen Simmons,W15,,"Fintech,Banking and Exchange",0,New York,,Direct Match was a venture-backed startup building the first all-to-all US Treasury trading venue.,Direct Match,"New York, NY, USA",,Inactive,,11,http://directmatchx.com
"Michael Douglas,Euwyn Poon,Wilkins Wing-Hei Chung",W15,,"Consumer,Social",0,"Ljubljana, Slovenia",,"3dot is a think-tank company based in Ljubljana, Slovenia. Our core business is developing ideas, products and services based on newest technologies for our partner companies and their customers.

The companies we work with rely on us to provide them with the craziest new ideas, technological breakthrough services and amazing new products. Our usual daily job is brainstorming on new and polishing existing ideas that will soon enter the market.",3dot,"Ljubljana, Ljubljana, Slovenia",,Inactive,,2,http://3dot.com
"Chris Anderson,Saurabh Srivastava",W15,,"Healthcare,Industrial Bio",0,San Francisco,,"The next decade is going to see a biotech revolution fueled by three technologies: ability to read DNA (sequencing), ability to write DNA (synthesis), and computational systems that predict what DNA to read and write. With sequencing and synthesis being mainstream now [1], 20n provides the computational systems that predict DNA design for novel industrial biotech and health applications.

At 20n, we are taking a fresh look at turning biological data into information. We approach it as a big data learning problem, and bring to bear techniques from machine learning, distributed systems, AI planning, program synthesis, data mining, and natural language processing. With the support of DARPA [2], we are building a team of computer scientists, and bioengineers to look at biology in fundamentally new ways.

Our current customers include industrial biotech firms that are leading the charge in transitioning us from traditional unsustainable means of manufacturing to sustainable biological processes leading to advanced fuels, materials, therapeutics, and flavors and fragrances. 20n’s technology helps them enter markets previously thought inaccessible for biology.

[1] Sequencing DNA costs $4k/genome (http://www.genome.gov/sequencingcosts/) and is expected to go down to $1k/genome. Synthesizing DNA is at 20cents/bp, and is expected to go down to 0.1cents/bp.
[2] DARPA in the past supported work that led to the internet, stealth planes, GPS, and even Douglas Engelbart’s mother-of-all-demos.",20n,"San Francisco, CA, USA",Using AI to predict biochemistry for manufacturing and therapeutics,Inactive,"artificial-intelligence,biotech",2,http://20n.com
"Evan Dancer,Tim Jones,Jason Okra",W15,,"Real Estate and Construction,Housing and Real Estate",0,"Ann Arbor, MI",,Cribspot is an online platform for college students and property managers that streamlines finding and leasing off-campus housing.,Cribspot,"Ann Arbor, MI, USA",Tech-Enabled Real Estate Company (YC W15),Inactive,real-estate,2,http://cribspot.com
"Andy Roberts,Katherine Sears,Kenneth Shear",W15,2010,"B2B,Marketing",0,"Seattle, WA",https://bookface-images.s3.amazonaws.com/small_logos/62543fd96b43537ecbd9be593590310621e8dbfd.png,"** NO LONGER IN BUSINESS **

Booktrope is reinventing the way books are published. We are not a self-publishing operation. What does that mean? At Booktrope we do not charge authors to publish nor do we accept all submissions.

We have pioneered a concept called “Team Publishing” which addresses the way books are actually developed, not just the way they are distributed and read. We offer print, ebook, and web versions of all our books, in other words, we are format agnostic. We don’t want to debate the death of print books, or the birth of ebooks, we love and support them all. 

A typical Publishing Team consists of an author, editor, designer and business/marketing manager for the book. You don’t get assigned projects in our system; you choose the people you work with.  We work much more quickly than traditional publishers, taking advantage of new technologies to streamline the process of getting books into the hands of readers. Lastly, we use that same technology to keep overhead low, and we think that the bulk of the revenue from book sales should go back to the creative team that makes them happen.",Booktrope,"Seattle, WA, USA",Booktrope provides a software platform that makes it easy for…,Inactive,,51,http://booktrope.com
"Peggy Mangot,Bob Haigler",W15,,"Fintech,Consumer Finance",0,San Francisco,,"SparkGift is a Y Combinator backed technology startup that makes it easy to give investments as gifts.  

The founders came together with a common vision that it should be as easy to give someone an investment in the future, as it is to give someone a retail gift card.  SparkGift supports small dollar gifts and fractional shares, so you can give someone a $20 investment in Apple or a Vanguard index fund.

SparkGift is creating products that make investing simple, enjoyable and accessible to the masses.  Our mission is to use gifts to create new savers & investors at scale.",SparkGift,"San Francisco, CA, USA",SparkGift makes it easy to send stocks and index funds as gifts to…,Inactive,"investing,stocks",2,http://sparkgift.com
"Brian Glick,Julian Frumar",W15,,"Consumer,Social",0,San Francisco,https://bookface-images.s3.amazonaws.com/small_logos/fc62c7f765811725a1be28fa2f60f0afdf21ab3c.png,"GroupAhead is a YC-backed company that allows groups to create their own dedicated smartphone apps. The easy-to-use, single-purpose app focuses solely on connecting an organization's members. With a dedicated,  specialized app, member involvement and event attendance goes up, and push notifications cut through the noise of email and Facebook.",GroupAhead,"San Francisco, CA, USA",Improve communications with your group's own mobile app.,Inactive,"messaging,team-collaboration",2,https://
Saleem Khatri,W15,,"Fintech,Asset Management",0,Mountain View,,"Investors can list their trades on Instavest, including the company, share amount and rationale behind the investment. Other users can invest alongside the people willing to share their own purchases and sales. Instavest encourages you to block out a portion of your profits — in the neighborhood of 5 percent — that might arise from the transaction for the original listing entity.",Instavest,"Mountain View, CA, USA",,Inactive,,2,http://goinstavest.com
"Montana Low,Tim Robertson",W15,,"B2B,Engineering, Product and Design",0,San Francisco,,"Omniref is a code-based reference, maintained by and for the programming community. Find questions, comments, links and documentation on the code that you're already using.",Omniref,"San Francisco, CA, USA","Sticky notes for code.

(We're building a community-powered,…",Inactive,developer-tools,2,http://omniref.com
"Stefano Bernardi,Andrew McCalister,Sean Watters",W15,2015,"B2B,Finance and Accounting",0,San Francisco,https://bookface-images.s3.amazonaws.com/small_logos/3cc40f4ad7f1a4c8daf225ecefb4a4b061480c6e.png,"Kickpay is transforming how companies finance their inventory.

By leveraging a client's data, we enable them to access financing that was previously unavailable, allowing them to grow faster.

With Kickpay, you only pay for inventory after it sells. Not months beforehand. ",Kickpay,"San Francisco, CA, USA",A platform to finance inventory for e-commerce companies.,Inactive,fintech,2,https://kickpay.com
"Phillip Akhzar,Nick Carson",W15,,"B2B,Supply Chain and Logistics",0,San Francisco,https://bookface-images.s3.amazonaws.com/small_logos/fcb8f74b73307ed4303eceb91f55cc00e877aa35.png,"2000+ customers use Pakible including Samsung, Reddit, Soylent, and the Golden State Warriors.

We make it insanely easy to design, price, and manufacture custom product packaging.

Leveraging in house software to automate operations, an incredibly user-friendly customer-facing interface, plus amazing people + vendors. Pakible is an unbeatable experience and price compared to brokers or direct manufacturers.

Packaging is the most slept-on market in the world, a $500B market just domestically representing over 2% of US GDP.

We're a startup of < 10 people. Come build something special with us, and have a huge role in doing so.",Pakible,"San Francisco, CA, USA","We make it insanely easy to design, price, and manufacture custom…",Inactive,manufacturing,3,https://pakible.com
Taylor Fairbank,W15,,"Healthcare,Healthcare IT",0,New York,,Rescheduling for residency programs. Rescheduling is one of the largest logistics pain points in hospitals and residency programs. Reschedule provides an end-to-end work flow to manage graduate medical education scheduling.,ReSchedule Med,"New York, NY, USA","We help medical residency programs create and manage their schedules,…",Inactive,"scheduling,healthcare",0,http://reschedulemed.com
"Blake Adams,Andii Davis",W15,,"Consumer,Home and Personal",0,San Francisco,,Rare Door is an ecommerce platform that helps user discover and buy great products available in nearby stores.,Rare Door,"San Francisco, CA, USA",Empowering brick-and-mortar retailers to sell more and engage shoppers,Inactive,"e-commerce,retail",2,http://raredoor.com
"Brian Gallagher,Ben Herila,Jeffrey Shaw,Brandan Zaucha",W15,2014,"Consumer,Food and Beverage",0,San Francisco,https://bookface-images.s3.amazonaws.com/small_logos/e2374ef712842b9bd394bdffe7701804a97fdaf2.png,Underground Cellar is a leading wine e-commerce company that is changing the way wine is bought and sold in the $70B consumer US wine market through ‘gamification’. We provide a unique and exciting experience that gives wine buyers a great value by using upgrades instead of discounts. Wine sellers love Underground Cellar too as it allows them to quickly sell bottles while protecting their brand.,Underground Cellar,"San Francisco, CA, USA",Upgrading Your Wine Experience,Inactive,"marketplace,e-commerce,food-&-beverage",26,http://undergroundcellar.com
"Austin Vedder,Matt Tognetti",W15,,"B2B,Productivity",0,San Francisco,,"Messaging solution that retail employees use every day

Reduce employee turnover and save managers time",Shift Messenger,"San Francisco, CA, USA",Real-time communication solution for retail and restaurant employees.,Inactive,"restaurant-tech,retail",2,http://shiftmessenger.com
"William Baron,Mark Salpeter",W15,,"B2B,Retail",0,San Francisco,https://bookface-images.s3.amazonaws.com/small_logos/1374fe13d174c148fb1387b6b1974226f5411900.png,"Dealyze is an in-store digital custom rewards and referral program with automated marketing tools for small businesses that is proven to bring back customers. Tailored to your specific needs, Dealyze ensures every transaction is a chance to build a relationship. Our mission is to bring a powerful digital marketing platform to any store. We hope to even the playing field by doing our part in building the next generation of business tools. Dealyze has the backing of top-tier investors including Y-Combinator. The company is headquartered in Silicon Valley.

Visit www.Dealyze.com to learn more about the company, schedule a demo, or just inquire about joining us.",Dealyze,"San Francisco, CA, USA",Dealyze helps national retailers build exceptional customer and…,Inactive,"retail-tech,retail",6,http://dealyze.com
"Matt Galloway,George Smith",W15,,"Fintech,Consumer Finance",0,Mountain View,,"Glassjar designs and develops software that enables its users to manage their flat's shared expenses. It offers Flatting, a software product that enables its users to keep track of their flat's expenses, including flat account, flat-mates, and payments. The company offers a dashboard that provides an overview of their flat accounts, such as how much is available to spend, each person’s ledger, and summaries of their previous spending.

Glassjar was founded by Matthew Galloway and George Smith in 2013; and is headquartered in Wellington, New Zealand.",Glassjar,"Mountain View, CA, USA",Clean app for check writing,Inactive,"fintech,payments",2,http://glassjar.co
Brien Colwell,W15,,"B2B,Infrastructure",0,,,"Nextop IO is a mobile content delivery network (CDN) that optimizes the path between mobile applications and back ends. It offers a client-side networking library that integrates with iOS and Android operating systems; network of proxies that speaks a custom protocol to optimize delivery times, throughput, and data and battery usage; and metrics to visually monitor and debug connection quality in its users’ applications.

Nextop IO was launched in 2014.",Nextop,,Nextop optimizes the path between your app and backend. Client…,Inactive,developer-tools,2,http://nextop.io
