active_founders,batch,founded,industry,jobs,location,logo,long_description,name,region,short_description,status,tags,team_size,website
"Carly Leahy,Afton Vechery",S17,2017,"Healthcare,Consumer Health and Wellness",0,San Francisco,https://bookface-images.s3.amazonaws.com/small_logos/b80c9ee16644141e27cf06459324dccdc7fd94bf.png,"We're a women’s health company making personalized reproductive health information more accessible, earlier in life. We make the same laboratory tests that were previously confined to fertility clinics more accessible for women at home. By arming women with powerful information about their reproductive health, Modern Fertility is closing the fertility information gap and enabling women to own the decisions impacting their bodies and futures. We've raised $22 million from Forerunner Ventures, Maveron, Union Square Ventures, First Round Capital, #Angels and Y Combinator.
",Modern Fertility,"San Francisco, CA, USA",At-home fertility test for women who aren't ready for kids right now…,Acquired,"fertility-tech,consumer-health-services,women's-health",25,https://www.modernfertility.com
Reilly Sweetland,S17,,"B2B,Productivity",0,"San Jose, CA",https://bookface-images.s3.amazonaws.com/small_logos/793024bcad049e570384ad1ef56b89ad94fe10db.png,"FollowUpThen is a personal assistant that sends you exactly what you need at exactly the right moment to get something done. Its uncanny timing is not the result of AI wizardry, but rather an explicit reminder syntax that is embedded in an email address. Email 1min@followupthen.com, 1hour@followupthen.com or {any-time}@followupthen.com and you'll get the email back at that time. Adding a reminder to any email is a one-second operation thanks to your email client's address autocomplete.

Example use-cases include:
 * Following up with sales prospects
 * Maintaining relationships
 * Task delegation (put FollowUpThen in the bcc field)
 * Just-in-time reminders to get a task done (pay bills, etc)
 * Hitting inbox zero (forwarding emails to your future)

In today's workplace we are bombarded with realtime demands on our attention. FollowUpThen answers this trend by making work more asynchronous, allowing you to place information in the future,  giving you freedom and peace of mind in the present and allowing you actually get something done.",FollowUpThen,"San Jose, CA, USA",FollowUpThen is an email-based personal assistant that sends you…,Active,"artificial-intelligence,productivity,automation",1,https://www.followupthen.com/
"Edward Cibor,Steven Clausnitzer,Mark Katakowski",S17,2015,"Healthcare,Therapeutics",0,"Ann Arbor, MI",https://bookface-images.s3.amazonaws.com/small_logos/2551f858875b49e48688473a8dad17ee8425d618.png,"Forever Labs collects and stores adult stem cells, and develops therapies based upon stem cell rejuvenation.",Forever Labs,"Ann Arbor, MI, USA","We bank your stem cells to help you live healthier, longer.",Active,,12,https://foreverlabs.com
"Jan Alexander Jedlinski,Benjamin Bartakovics,Daniel Bartakovics,Michael Ströck",S17,2017,"B2B,Recruiting and Talent",0,New York,https://bookface-images.s3.amazonaws.com/small_logos/2eb845253b30b7d03651816b8bbbf27b80eaffa2.png,"Candidately simplifies the process of sharing candidate resumes between staffing firms and their clients. Instead of relying on email attachments, Candidately offers a collaborative space where staffing firms can submit their top candidates, receive prompt client feedback, track client activity on candidate profiles, and increase the number of successful placements.",Candidate.ly,"New York, NY, USA",The digital storefront for staffing and recruiting teams.,Active,"saas,b2b,recruiting,hr-tech",9,https://candidate.ly/
"Alyona Medelyan,Nathan Holmberg",S17,2017,"B2B,Analytics",0,"Auckland, New Zealand",https://bookface-images.s3.amazonaws.com/small_logos/0b48025641b05918c9b633d6b880a9862bf27619.png,"Thematic is a Customer Feedback Analysis platform. We pull feedback from sources you already use for surveying or talking to customers. We automatically discover themes in feedback and provide visualizations and reports that help improve customer satisfaction, prioritize product roadmap and track trends in customer feedback over time.",Thematic,"Auckland, Auckland, New Zealand",We analyze feedback to help companies improve customer loyalty,Active,"saas,b2b",21,http://www.getthematic.com
"Reeju Datta,Akash Sinha",S17,,"Fintech,Payments",1,"Bengaluru, India",https://bookface-images.s3.amazonaws.com/small_logos/7eb68658869d911582ae784bc8ff049cb6b4a898.png,"Cashfree is a next-generation payments company for Indian businesses. 

Cashfree helps 50,000+ businesses collect and send money with solutions such as an easy to integrate payment gateway that supports instant settlements & refunds; Payouts - an API banking platform for bulk disbursals; a split payment solution for marketplaces; a Bank Account Verification API; a dedicated UPI stack for businesses and Auto Collect - a virtual account solution to match inbound payments to customers. It counts Xiaomi, Nykaa, Zomato, Zoomcar, Cred, Swiggy, Shell, Zepto, Dunzo as well as donation platforms like Ketto and Milaap amongst its customers.

Cashfree is a licensed payment aggregator in India and works with all leading banks to build the core payments and banking infrastructure that powers Cashfree’s products. Cashfree is also integrated with major platforms like Shopify, Wix, Paypal, Amazon Pay, Ola Money and Google Pay.",Cashfree Payments,"Bengaluru, KA, India",Next-gen digital payments provider for India.,Active,payments,200,https://www.cashfree.com/
"April Chang,Robert Bartruff",S17,,"B2B,Recruiting and Talent",0,San Francisco,https://bookface-images.s3.amazonaws.com/small_logos/0f3baff26589296bfbecd152fe3a887fd60a04b0.png,10by10 is a marketplace to instantly match qualified candidates with companies by pooling candidates across recruitment agencies. Check out the testimonials on our website (www.10by10.io).,10 By 10,"San Francisco, CA, USA",10by10 is a unique marketplace in the recruiting agency industry for…,Active,"artificial-intelligence,marketplace,recruiting",5,https://10by10.io
"Matt Feury,Garrett Langley",S17,2017,"B2B,Engineering, Product and Design",10,"Atlanta, GA",https://bookface-images.s3.amazonaws.com/small_logos/ee69b5c905088288ff0fc007921dde14514a40a1.png,"Flock Safety provides the first public safety operating system that empowers private communities and law enforcement to work together to eliminate crime. We are committed to protecting human privacy and mitigating bias in policing with the development of best-in-class technology rooted in ethical design, which unites civilians and public servants in pursuit of a safer, more equitable society. 

Our Safety-as-a-Service approach includes affordable devices powered by LTE and solar that can be installed anywhere.  Our technology detects and captures objective details, decodes evidence in real-time and delivers investigative leads into the hands of those who matter. 

While safety is a serious business, we are a supportive team that is optimizing the remote experience to create strong and fun relationships even when we are physically apart. Our flock of hard-working employees thrive in a positive and inclusive environment, where a bias towards action is rewarded. Flock Safety is headquartered in Atlanta and operates nationwide. We have raised $150M in our Series E led by Tiger Global at a $3.5B valuation.",Flock Safety,"Atlanta, GA, USA",The first public safety operating system that eliminates crime.,Active,"hardware,machine-learning",1000,http://www.flocksafety.com
"Imran Khoja,Travis Noll",S17,2017,Government,1,Palo Alto,,"Our goal is to empower local government employees with the tools, technology, and support they need so they can deliver exceptional service to their taxpayers and feel proud of the work they do for their communities. We contribute by building software to streamline local government tax assessors’ workflows using AI. Specifically, we streamline the change of ownership process for real estate and create more seamless ways for tax offices to communicate digitally with their taxpayers.  

For instance, when properties get bought and sold, local governments have to process reams of paper in order to update their systems and perform the analyses necessary to update the tax roll. Our software makes this process 10x faster and much more enjoyable for employees in the tax office to complete, and creates trust and goodwill in the minds of taxpayers. ",Just Appraised,"Palo Alto, CA, USA",Just Appraised makes software for local governments.,Active,"saas,govtech",40,https://www.justappraised.com
Steven Bartel,S17,2017,"B2B,Recruiting and Talent",0,San Francisco,https://bookface-images.s3.amazonaws.com/small_logos/6a37f8c6b6d3cddaee978aab62ebe0f6bacec7db.png,"Gem’s talent engagement platform helps recruiting teams use data and automation to improve hiring speed, quality, and diversity.

Gem unifies data and context from the tools recruiters use every day, including email, applicant tracking systems, LinkedIn, and other social networks, to create a source of truth for all talent relationships. Armed with insights about the entire recruiting process, automation to reach out to talent at scale, and true cross-functional collaboration tools, TA teams can proactively and strategically plan for what’s ahead.

Gem's customers are savvy recruiting teams from industry-leading companies — like Wayfair, Dropbox, Nasdaq, Cisco, and Doordash — who understand that hiring the best talent in the market is key to maintaining their competitive advantage.",Gem,"San Francisco, CA, USA",Talent engagement platform,Active,"saas,b2b,recruiting",200,https://www.gem.com/
Adam Breckler,S17,,"Consumer,Job and Career Services",0,San Francisco,,,Prism Labs,"San Francisco, CA, USA",,Inactive,,5,https://
Leila Madrone,S17,,"Industrials,Energy",0,San Francisco,https://bookface-images.s3.amazonaws.com/small_logos/d2a2011cd8d88972eec582c9fa98805864f2373f.png,"Sunfolding was founded in 2012 with headquarters in San Francisco, CA. Sunfolding designs, manufactures and sells balance of system products that offer cost and performance breakthroughs to stakeholders across the solar industry. Currently, Sunfolding’s main product offering is an advanced solar tracker, Sunfolding T29™ Horizontal Single Axis Tracker.

Sunfolding’s executive team has collectively built and sold GWs of solar globally, successfully launching new solar products and technologies at leading solar companies including First Solar, SMA America, Kaco, and SunPower. The Sunfolding team is a blend of top technical talent with recognized industry leaders",Sunfolding,"San Francisco, CA, USA",Sunfolding builds next generation infrastructure for solar farms.  By…,Inactive,"solar-power,climate",44,http://www.sunfolding.com
LC Carrier,S17,,"Consumer,Gaming",0,San Francisco,,"Gameday is the easiest way to play fantasy sports with friends. We make daily fantasy sports fun for everyone, with a simple and quick version of the game over chat.",Gameday,"San Francisco, CA, USA",Play fantasy sports with friends on Facebook Messenger,Inactive,"gaming,social",2,http://playgameday.com
"Zi Guo,Vikram Rangraj",S17,,"Consumer,Gaming",0,"Seattle, WA",,"Dropleaf is a response to an industry that could be so much better than it is. They want to provide everyone with a never ending stream of transformative experiences, but doing that is going to require us to change the space around games. Players need to be able to find the experiences that feel made for them, and the community around those games has to be welcoming and inclusive. Independent developers, meanwhile, need a way to improve discoverability, extend their revenue stream and find a space in which content is rewarded based on quality, not marketing budget.

They are working to fix every one of those problems. They have built a discovery system that’s going to help you find games you truly love. Our community is a work in progress, but you can learn more on our blog. And our library is going to keep growing, so that when you finish one great game, you’ll find another that you’d swear was made with you in mind.",Dropleaf,"Seattle, WA, USA",Subscription service for all you can play indie PC games. ,Inactive,gaming,2,https://dropleaf.io
Matthew Whalley,S17,,"Industrials,Aviation and Space",0,"Johannesburg, South Africa",https://bookface-images.s3.amazonaws.com/small_logos/c95842a8ebd992360790565045dc0b9949e8dea8.png,Passerine Aircraft develops electric-powered aircraft that can attain flight speed using a jumping mechanism.,Passerine Aircraft,"Johannesburg, GP, South Africa",Passerine Aircraft is building the next generation of dronesWe are…,Inactive,,2,http://www.passerineaircraft.com/
David Head,S17,2015,"B2B,Engineering, Product and Design",0,San Francisco,https://bookface-images.s3.amazonaws.com/small_logos/3fd41605fa44214a528c098a1a0d2e1fcf2982d4.png," Sixty is the fastest way to get on demand web app help. Hire an expert by-the-minute to jump on a screenshare for help with your web design, development, software implementations, and more.

Starting at $1/min.",Sixty,"San Francisco, CA, USA",On demand web app help,Inactive,"remote,customer-service",4,https://usesixty.com/
"Can Sar,James Vaughan",S17,,Government,0,,,Value Voting develops political targeting software for advocacy groups.,Value Voting,,Platform to defeat political extremism through strategic primary…,Inactive,,2,https://www.valuevoting.com
"Elizabeth Davis,Brandon Hill,Tre Kirkman",S17,,"Consumer,Social",0,Palo Alto,,"Our mission is to empower everyone to discover, create, and exchange meaningful ideas to awaken a more just world. Learn more at www.greo.com",Greo,"Palo Alto, CA, USA",Greo is a mobile video app for conversations about current events. ,Inactive,video,2,http://www.greo.com
Dwayne Shaw,S17,,"Consumer,Job and Career Services",0,San Francisco,,"Mystro is an automation app that makes on-demand drivers up to 30% more money. Mystro allows drivers to safely and easily run Uber, Lyft and other platforms simultaneously and auto accepts only the trips they want.",Mystro,"San Francisco, CA, USA",Mystro is an app that makes rideshare drivers up to 30% more money by…,Inactive,"artificial-intelligence,ridesharing,automation",6,http://www.mystrodriver.com
"Dave Ramish,John Ramish",S17,2015,"Healthcare,Healthcare IT",0,San Francisco,https://bookface-images.s3.amazonaws.com/small_logos/7b12b9972766f7004c5d876b2c0f54360b621239.png,,Semantix,"San Francisco, CA, USA",AI for medical billing,Inactive,"artificial-intelligence,healthcare",2,https://www.semantix.ai
Meredith Hitchcock,S17,,Government,0,San Francisco,,RideAlong is a software tool that gives patrol officers key information about people with mental illness at the scene—everything from tailored de-escalation techniques to personalized service referral options.,RideAlong,"San Francisco, CA, USA",We save lives by giving police and health workers key info to safely…,Inactive,"govtech,health-tech",2,http://www.getridealong.com
Reid Nahm,S17,2014,"Consumer,Home and Personal",0,New York,https://bookface-images.s3.amazonaws.com/small_logos/a9a5b774e50e9e2eb7c1a7ce1739c05ed4234858.png,"Covetly is a platform for collectors and hobbyists. Tons of rare, unique, and bizarre items await. Browse, trade, and buy or sell. What do you covet?",Covetly,"New York, NY, USA","#1 Collectibles Marketplace: Authentic Vinyl Toys, Comics, Funko Pop ",Inactive,"marketplace,social-media,e-commerce",3,https://www.covetly.com/
"Lauren Kelley-Chew,Luke Kelley-Chew",S17,,"Healthcare,Consumer Health and Wellness",0,San Francisco,,"Caelum Health treats chronic digestive diseases with digital therapeutics. They are a Y Combinator-backed healthcare startup building the first clinically-proven digital treatment for digestive health and IBS. They believe your healthcare should be personalized and data-driven -- cutting-edge science, top physicians, and expert coaching, all wrapped up in a treatment plan built just for your body.",Caelum Health,"San Francisco, CA, USA",Caelum Health is replacing drugs with software. We use behavioral…,Inactive,"digital-health,healthcare",2,https://caelumhealth.com/
"Axel Delafosse,Henry Fontanier,Raphael Doulonne",S17,,"Consumer,Social",0,"Paris, France",,Goosebump is a messenger app that helps users find live music events online.,Goosebump,"Paris, Île-de-France, France",Find the best electronic music events in a single message.,Inactive,entertainment,2,http://m.me/higoosebump
Sébastien Sikorski,S17,2017,"Consumer,Social",0,San Francisco,https://bookface-images.s3.amazonaws.com/small_logos/a905bc2437757c60c66b5a75941fb6ab1f076d8a.png,"Introducing Storyboard, the leading platform designed to connect the world's top brands, innovative creative agencies, and dynamic influencers with their communities on Instagram and Snapchat.

Our mission is to simplify and enhance your online presence on Instagram and Snapchat, offering a comprehensive suite of powerful and intuitive features:

1. Seamless Automation: Storyboard enables smooth, automatic sharing of your stories between Instagram and Snapchat. No more manual cross-platform management, saving you time while maintaining content consistency.

2. Advanced Performance Tracking: Measure the impact of your efforts with our advanced performance analytics toolkit. Gain in-depth insights into engagement, reach, and other essential metrics, empowering you to adjust your strategy in real time for optimal results.

3. Strategic Planning: Anticipate your campaigns by scheduling your stories and posts in advance. Our user-friendly interface lets you create a consistent editorial calendar, ensuring your content reaches your audience at the right times.

Discover how Storyboard can transform your presence on Instagram and Snapchat. Join visionary brands already placing their trust in Storyboard to optimize their social media presence. Whether you're a large corporation or an independent creative, our scalable platform will continue to deliver exciting new features to propel your online impact.",Storyboard,"San Francisco, CA, USA",Social media management tool for Instagram and Snapchat,Inactive,"saas,b2b,social-media",2,https://www.storyboard.com
"Soroush Ghodsi,Stefan Stokic",S17,,"B2B,Sales",0,San Francisco,,Slik automates lead generation and prospecting for sales teams.,Slik,"San Francisco, CA, USA",Slik enables the long tail to use email outreach. ,Inactive,"marketing,email",2,http://slik.ai
"Walker McHugh,Timothy Cornell",S17,2017,"Healthcare,Diagnostics",0,"South San Francisco, CA",https://bookface-images.s3.amazonaws.com/small_logos/519a74fb089a6c9dd854328b8022c68e00467972.png,"PreDxion Bio is working on a rapid saliva-based antigen test for the detection of SARS-CoV-2 S-protein in asymptomatic and presymptomatic patients. Our technology is uniquely capable of being scaled to 10's of millions of tests of days using semiconductor fab processes, a scale of testing necessary to better inform public health officials and policymakers and enable contact tracing at scale.

PreDxion Bio's origins are in critical care: our original technology is a rapid, near real-time cytokine and biomarker detection platform to monitor the immune response of critically-ill patients. This technology leverages a novel sensor platform we spun out of the University of Michigan. PreDxion Bio has received FDA Breakthrough Device designation and partnered with top pharmcos to monitor the immune response following CAR-T therapy and predict the development of cytokine release syndrome and neurological AEs, and for use in guiding precision medicine approaches in critical care.",PreDxion Bio,"South San Francisco, CA, USA","Rapid, scalable diagnostic for SARS-CoV-2 and beyond",Inactive,"microfluidics,nanosensors",6,http://www.predxionbio.com
Peter Sand,S17,,"Industrials,Agriculture",0,San Francisco,,,Modular Science,"San Francisco, CA, USA",We're making it easier to do sustainable farming.,Inactive,agriculture,,https://www.modularscience.com/
Jeffrey Zhao,S17,,"Consumer,Apparel and Cosmetics",0,San Francisco,,And Comfort is a direct to consumer fashion brand for plus-size women. We make plus-size basics and sell then online at andcomfort.com.,And Comfort,"San Francisco, CA, USA",And Comfort is a direct to consumer fashion brand for plus-size…,Inactive,fashion,2,http://andcomfort.com
Aaron Mandell,S17,,"Industrials,Climate",0,CA,https://bookface-images.s3.amazonaws.com/small_logos/057f67420dcdeb51981d4cda67b81fbfec2c2de2.png,"At Wacomet Water (formerly WATERFX) we are reimagining water. Our current water system was designed for a global population of three billion people and by the end of this century we will need clean water for over ten billion people. Our mission is to use technology to develop a new source of fresh water and make access to water affordable and abundant for every human being on the planet. We do this using solar-powered desalination to generate water from an infinite source of salt water and distribute this water via a peer-to-peer distribution platform called Liquid. Our mission is to provide a better, more reliable, 100% sustainable water service to consumers, businesses and cities.",WATERFX,"CA, USA",The world's first 100% sustainable water provider (aka alternative…,Inactive,sustainability,1,http://www.wacomet.com
Sanat Ghosh,S17,,"B2B,Recruiting and Talent",0,"Bengaluru, India",,"Fastpad builds hiring software for the Indian market that gets rid of spam and ensures that companies can see quick snapshots of real candidates.

Fastpad is looking to create the dominant recruitment marketplace by cutting through the noise in an Indian hiring marketplace that’s growing 40 percent year-over-year.",Fastpad,"Bengaluru, KA, India",Hiring Software for India,Inactive,recruiting,3,https://fastpad.com/
Richard Bronson,S17,2016,"B2B,Recruiting and Talent",0,"Los Angeles, CA",https://bookface-images.s3.amazonaws.com/small_logos/47f5c844b33712e59431159695b371d903107395.png,"We are the first/only national, for-profit employment platform for people with criminal records. With a community of 11 million+, we work with some of the country's largest employers, through our staffing business (70MillionStaffing.com) and job board (70MillionJobs.com). We've helped thousands of deserving men and women land a job and begin a safe, productive life.",Commissary Club (formerly 70 Million Jobs),"Los Angeles, CA, USA",Social network for 70 million Americans with criminal records.,Inactive,"marketplace,b2b",8,https://www.Commissary.Club
"Fernando Albertorio,Cuauhtli Padilla,Marco Trujillo",S17,2013,"Consumer,Virtual and Augmented Reality",0,"Zapopan, Mexico",https://bookface-images.s3.amazonaws.com/small_logos/62f673b354846f002903faed7c303cb22e8e4cba.png,"Sunu Nek is an AR neck-worn interface using radar, audio, and haptics to assist the mobility and daily living of visually impaired users. Haptics informs the users of obstacles around them in real-time through vibrations while audio helps orient the user via GPS voice features. 
Starting with the blind, the Sunu Nek is the next non-obtrusive human computing interface that will be used by all. The future will be more like ""Her"" than ""Ready player one"". ",Sunu,"Zapopan, Jal., Mexico",Audio and Haptics AR interface equipping blind users with super powers,Inactive,"assistive-tech,augmented-reality",11,http://www.sunu.com
"Vicc Alexander,Ranidu Lankage,James Zhang",S17,2015,"Consumer,Social",0,San Francisco,https://bookface-images.s3.amazonaws.com/small_logos/9f3875f87d063807072f9950fedbfde952f07243.png,"Polly is a fun social polling app for teens. The app allows users to create multiple-choice polls for sharing on Snapchat and other platforms. 

Polly launched in stealth in August and it quickly became popular among teens, with 20 million people voting over 100 million times across 5 million polls in the past month. 

In addition to being a casual social tool, Polly can also be used to gather opinions about popular brands. For instance, Polly received thousands of responses from teens on some of its own polls related to topics such as breakfast cereals and Starbucks drinks. Brands and influencers can also create their own polls to gather feedback from consumers.",Polly,"San Francisco, CA, USA",Polly is a social polling app for Snapchat and Instagram stories. ,Inactive,social,3,https://polly.fun/
"Rotem Yakir,Shahar Yakir",S17,,"Consumer,Social",0,"Tel Aviv-Yafo, Israel",https://bookface-images.s3.amazonaws.com/small_logos/fa28fb445c63a9acb4446010160b71d264986514.png,"imwith is a the only messenger where everyone is funnier.

Learn more about imwith at https://imwith.com",Guggy,"Tel Aviv-Yafo, Tel Aviv District, Israel","Guggy is building the messaging app of the future with real time,…",Inactive,messaging,2,https://guggy.com
